15677,James Martinez,44,France,s4851,Ibiza,"Comedies, Romantic Movies",94 min,4.322651491204006
20563,Michael Hernandez,48,Brazil,s8482,The Republic of Imbaba,"Dramas, International Movies",90 min,4.732819832298274
17655,Katie Johnson,48,Mexico,s8436,The Natural,"Classic Movies, Dramas, Sports Movies",138 min,0.09058212232714247
15153,Jane Davis,28,UK,s3094,The Vendor,"Comedies, International Movies",103 min,1.1548590869979025
4298,David Brown,34,India,s148,How to Be a Cowboy,Reality TV,1 Season,3.7934750840834246
12376,Jane Brown,68,USA,s1120,Into the Grizzly Maze,"Action & Adventure, Horror Movies",90 min,4.0003639672119995
20642,Jane Smith,71,UK,s2101,Septembers of Shiraz,"Dramas, Thrillers",110 min,3.6559430728188484
19167,Emma Brown,22,Germany,s6811,Frozen Planet,"British TV Shows, Docuseries, International TV Shows",1 Season,0.12967161894780976
21426,Katie Smith,60,Brazil,s7247,Kurtulus Son Durak,"Comedies, Dramas, International Movies",100 min,0.5601203959936513
12500,John Johnson,37,Japan,s4184,The World's Most Extraordinary Homes,"British TV Shows, Docuseries, International TV Shows",3 Seasons,4.0544691475456585
23328,David Brown,32,France,s6880,Good People,"Action & Adventure, Thrillers",90 min,4.668059194621079
2307,John Johnson,23,Mexico,s5430,Kanavu Variyam,"Comedies, Dramas, International Movies",104 min,2.160280930159107
14225,Michael Davis,55,Brazil,s1653,Andhaghaaram,"Horror Movies, International Movies, Thrillers",171 min,4.827160847675999
10640,John Hernandez,75,Germany,s3734,Adam Devine: Best Time of Our Lives,Stand-Up Comedy,59 min,3.98429737549624
24134,Michael Brown,47,Brazil,s8343,The Heretics,Horror Movies,88 min,3.807533178463
4848,James Miller,14,India,s6880,Good People,"Action & Adventure, Thrillers",90 min,2.5103763385216697
176,Sarah Smith,26,UK,s137,Cold Mountain,"Dramas, Romantic Movies",154 min,2.632068354235062
9974,John Garcia,35,Brazil,s2239,Sunny Bunnies,"British TV Shows, Kids' TV, TV Comedies",2 Seasons,2.24126539602437
20468,John Martinez,47,Germany,s2680,Maurício Meirelles: Generating Chaos,Stand-Up Comedy,63 min,4.146977239380468
11850,Michael Miller,51,Japan,s243,Comedy Premium League,"International TV Shows, TV Comedies",1 Season,4.460755247099213
24703,Alex Davis,23,Germany,s6225,Bana Masal Anlatma,"Comedies, International Movies, Romantic Movies",103 min,3.0232156257256477
4236,Michael Johnson,33,France,s2225,Funan,"Dramas, International Movies",87 min,4.874708388065271
11102,James Brown,64,Germany,s416,Chhota Bheem aur Krishna,Children & Family Movies,68 min,3.9055036214663557
4503,Sarah Johnson,75,Brazil,s533,Scream,"Crime TV Shows, TV Horror, TV Mysteries",3 Seasons,3.1264159789004093
14214,James Brown,68,France,s5852,Belgica,"Dramas, International Movies",127 min,2.7335602230540723
323,Chris Johnson,62,Australia,s1404,Double Dad,"Children & Family Movies, Comedies, Dramas",105 min,1.509318828416331
6047,Jane Hernandez,47,Germany,s6385,Bruno and Boots: This Can't Be Happening at Macdonald Hall,"Children & Family Movies, Comedies",90 min,2.4111356692713737
2142,James Smith,78,Canada,s8708,"We, the Marines","Documentaries, International Movies",38 min,3.3262619270877414
15574,James Martinez,23,Japan,s4258,Selection Day,"International TV Shows, TV Dramas, Teen TV Shows",1 Season,4.703555188040653
23043,Michael Williams,73,India,s7864,Revenge of the Green Dragons,"Action & Adventure, Dramas, Independent Movies",95 min,4.365695344968768
752,Katie Williams,73,Australia,s3133,Dil Dhadakne Do,"Comedies, Dramas, International Movies",174 min,2.604468819412059
1086,Katie Davis,78,USA,s3416,THE UNLISTED,"Kids' TV, TV Thrillers",1 Season,0.38738866265219885
8144,Emma Johnson,48,Japan,s4062,Sarvam Thaala Mayam (Tamil Version),"Dramas, International Movies, Music & Musicals",131 min,2.8136225607888417
24874,Sarah Johnson,17,Mexico,s2437,Mr. Romantic,"Comedies, International Movies, Romantic Movies",97 min,2.6395067881365133
11815,Michael Smith,77,Mexico,s410,Chhota Bheem & Krishna: Pataliputra- City of the Dead,Children & Family Movies,66 min,0.8739862176093355
2594,Jane Brown,26,France,s7239,Kuldip Patwal: I Didn't Do It!,"Dramas, Independent Movies, International Movies",126 min,0.1960060219233689
16715,Katie Martinez,49,Canada,s6951,Heartthrob,Thrillers,87 min,3.8468819714350304
4753,Jane Williams,53,Canada,s790,Downton Abbey,"British TV Shows, International TV Shows, TV Dramas",6 Seasons,3.3320895153215284
18464,James Smith,28,Brazil,s3861,Crime Diaries: Night Out,"Crime TV Shows, International TV Shows, Spanish-Language TV Shows",1 Season,1.9978324840955775
2201,John Johnson,32,France,s3103,Sweetheart,"Horror Movies, Sci-Fi & Fantasy, Thrillers",83 min,1.039885179430886
1641,Sarah Davis,34,Mexico,s3546,Uncle Naji in UAE,"Comedies, International Movies",95 min,1.989652888219105
13156,Jane Martinez,79,UK,s4482,Baahubali: The Beginning (English Version),"Action & Adventure, Dramas, International Movies",138 min,3.9713822687689486
11031,Michael Brown,65,Brazil,s3672,Extreme Engagement,"International TV Shows, Reality TV",1 Season,4.768869825611911
11996,Katie Johnson,60,Canada,s8015,Sicilian Ghost Story,"Dramas, International Movies, Thrillers",119 min,1.4528002698114029
14358,Chris Williams,58,France,s2491,The Married Couples,"Comedies, International Movies, Romantic Movies",195 min,3.8741581988503624
8853,Jane Johnson,45,Japan,s4956,Paheli,"Dramas, International Movies, Romantic Movies",134 min,4.639799261581191
6456,Sarah Smith,23,Brazil,s1246,Word Party,Kids' TV,5 Seasons,0.5187502719187265
21814,James Martinez,64,Brazil,s3889,Loving is Losing,"Comedies, International Movies, Romantic Movies",91 min,0.9442461266181684
10888,Emma Garcia,52,Canada,s1122,Legally Blonde,"Comedies, Romantic Movies",96 min,4.210192440237812
3786,Michael Miller,53,Brazil,s2152,High Seas,"Crime TV Shows, International TV Shows, Spanish-Language TV Shows",3 Seasons,3.8346520731048312
24151,Katie Smith,65,Canada,s2660,Middleditch & Schwartz,TV Comedies,1 Season,1.2302444836784114
3388,David Brown,39,Brazil,s4272,Lion Pride,"International TV Shows, Romantic TV Shows, TV Comedies",1 Season,3.305236166292895
21901,James Hernandez,32,Brazil,s3703,Dope,"Crime TV Shows, Docuseries",3 Seasons,1.7297395626178402
24534,Katie Williams,79,Canada,s4135,Manusangada,"Dramas, Independent Movies, International Movies",93 min,2.6008932085875456
14553,Chris Smith,44,USA,s7278,LeapFrog: Phonics Farm,Movies,35 min,3.4627976967161582
12259,Katie Brown,41,France,s2921,Love Is Blind,"Reality TV, Romantic TV Shows",1 Season,3.161375619203267
6666,Michael Brown,73,Mexico,s8802,Zinzana,"Dramas, International Movies, Thrillers",96 min,4.881957959512789
19249,David Martinez,56,Brazil,s239,Boomika (Malayalam),"Horror Movies, International Movies, Thrillers",122 min,3.3853426054035856
7619,Michael Smith,51,India,s6900,Growing Up Coy,"Documentaries, LGBTQ Movies",82 min,0.7306226037264724
13042,Michael Davis,38,Japan,s4636,Al Hayba,"Crime TV Shows, International TV Shows, TV Dramas",1 Season,2.529457323760197
8527,James Martinez,24,Japan,s5990,13TH: A Conversation with Oprah Winfrey & Ava DuVernay,Movies,37 min,4.949154665616064
23939,Alex Hernandez,64,India,s8021,Silver Spoon,"Crime TV Shows, International TV Shows, TV Action & Adventure",2 Seasons,2.7020981275357405
23423,Chris Jones,42,France,s5616,Imperial Dreams,Dramas,86 min,2.0846919048177304
4146,Jane Martinez,76,Japan,s1094,The Big Day,"International TV Shows, Reality TV, Romantic TV Shows",2 Seasons,4.147376416660936
7090,Sarah Jones,71,Canada,s5070,The Shannara Chronicles,"TV Action & Adventure, TV Dramas, TV Sci-Fi & Fantasy",2 Seasons,2.7555328573356834
12973,Jane Smith,23,Australia,s7059,Immoral Tales,"Dramas, International Movies, Romantic Movies",103 min,1.9023712656104559
21977,Michael Jones,51,Brazil,s3068,"Nisman: The Prosecutor, the President, and the Spy","Crime TV Shows, Docuseries, International TV Shows",1 Season,0.1243503147395153
8660,Emma Jones,33,France,s7004,Hot Bot,Comedies,93 min,4.419687278308885
248,John Garcia,57,Brazil,s6975,Historia de un clan,"Crime TV Shows, International TV Shows, Spanish-Language TV Shows",1 Season,2.1569808682016895
18738,Sarah Hernandez,23,USA,s7413,Martin Luther: The Idea that Changed the World,"Documentaries, Faith & Spirituality",55 min,0.07446646521636902
6571,Chris Smith,43,Canada,s8460,The Plan,"Dramas, International Movies, Thrillers",124 min,0.6153618089101842
19138,James Miller,25,France,s1896,H2O: Just Add Water,"Kids' TV, TV Dramas",3 Seasons,2.897164088603941
13533,Alex Hernandez,44,Mexico,s3877,Angel 'N' Devil,"International TV Shows, TV Action & Adventure, TV Comedies",1 Season,4.010030448089326
1235,Sarah Martinez,58,Japan,s4315,Vir Das: Losing It,Stand-Up Comedy,68 min,2.877182713837443
24722,Katie Williams,28,Canada,s3416,THE UNLISTED,"Kids' TV, TV Thrillers",1 Season,2.953885488201199
8199,Chris Miller,49,Australia,s4130,Safe,"British TV Shows, Crime TV Shows, International TV Shows",1 Season,0.6949476370461777
10157,Chris Jones,30,Australia,s3458,Seis Manos,"Anime Series, Crime TV Shows",1 Season,1.1815809921076985
18651,Michael Brown,61,Canada,s8688,Waarrior Savitri,"Action & Adventure, International Movies, Sci-Fi & Fantasy",120 min,4.063127430548333
12153,Alex Garcia,74,Australia,s5617,Dilwale,"Action & Adventure, Dramas, International Movies",154 min,2.8977030073862253
3994,John Smith,21,Japan,s6470,Chill with Bob Ross,TV Shows,1 Season,0.1057685553308102
4753,Jane Williams,53,Canada,s8098,Storage Wars: Northern Treasures,"International TV Shows, Reality TV",1 Season,2.8059289255427444
1522,Emma Williams,32,Mexico,s4344,Look for a Star,"Comedies, International Movies, Romantic Movies",117 min,0.9992501707798851
3937,James Martinez,44,Mexico,s894,Wave of Cinema: Filosofi Kopi,"Documentaries, International Movies, Music & Musicals",64 min,1.7796445943331562
15296,Emma Davis,70,India,s3222,Merry Happy Whatever,TV Comedies,1 Season,1.5793674699656042
14939,Katie Johnson,52,Mexico,s4173,Conversations with a Killer: The Ted Bundy Tapes,"Crime TV Shows, Docuseries",1 Season,4.446838369083546
6990,Chris Martinez,61,Australia,s8576,This Is My Love,"International TV Shows, Korean TV Shows, Romantic TV Shows",1 Season,2.1983695449169343
18438,John Jones,47,France,s539,The A List,"British TV Shows, International TV Shows, TV Dramas",2 Seasons,2.688975521516987
2483,Chris Jones,41,France,s6647,Dramaworld,"Romantic TV Shows, TV Comedies, TV Dramas",1 Season,0.6936953359508657
20647,Jane Miller,56,India,s4318,Dumplin',"Comedies, Dramas, Independent Movies",110 min,4.054470829973816
19164,Michael Hernandez,79,Canada,s1699,The Crown,"British TV Shows, International TV Shows, TV Dramas",4 Seasons,3.809757418241814
17776,David Miller,18,Mexico,s7643,Officer Downe,Action & Adventure,91 min,4.668828478895785
14165,Chris Garcia,32,USA,s445,Naomi Osaka,Docuseries,1 Season,3.681513814284512
4381,Alex Johnson,50,India,s6755,Final Destination 2,"Horror Movies, Thrillers",90 min,2.810459033351653
21888,David Hernandez,76,India,s8053,Solo: A Star Wars Story (Spanish Version),"Action & Adventure, Children & Family Movies, Sci-Fi & Fantasy",135 min,1.1064476665580942
184,John Davis,20,Australia,s3226,Little Singham: Mahabali,"Children & Family Movies, Comedies",69 min,2.306539438195318
2214,Jane Brown,25,UK,s1227,The Houseboat,"Docuseries, International TV Shows",1 Season,0.49454415528680906
4605,Sarah Williams,13,India,s261,The Defeated,"Crime TV Shows, International TV Shows, TV Dramas",1 Season,2.804798850137178
8249,Sarah Garcia,32,Germany,s7800,Prosecuting Evil: The Extraordinary World of Ben Ferencz,Documentaries,83 min,4.956771925137381
10025,Jane Miller,59,Mexico,s5630,Pink,"Dramas, International Movies",130 min,0.33347741937849396
1666,Sarah Jones,25,USA,s6977,History's Greatest Hoaxes,"British TV Shows, Docuseries",1 Season,3.9508170063349004
17307,John Johnson,21,Japan,s8798,Zak Storm,Kids' TV,3 Seasons,2.1858458299919237
500,Emma Smith,55,Australia,s6884,Goosebumps 2: Haunted Halloween,"Children & Family Movies, Comedies",90 min,1.4717039358049266
673,John Williams,18,Brazil,s6649,Dream Boat,"Documentaries, International Movies, LGBTQ Movies",92 min,3.0957703175293405
10647,Emma Garcia,16,Canada,s5798,Extremis,Documentaries,25 min,0.33650416349060686
9686,Jane Martinez,55,Canada,s6065,A Week in Watts,Documentaries,91 min,3.9618675831612524
4144,Sarah Johnson,30,Germany,s7145,Judwaa,"Comedies, International Movies, Romantic Movies",133 min,1.6895610647476573
18033,Chris Miller,23,Germany,s6543,Crime Time,"Crime TV Shows, International TV Shows, TV Action & Adventure",1 Season,4.7280604116089275
5423,Katie Hernandez,45,Australia,s4909,Goodnight DJ 1,"International TV Shows, TV Dramas, TV Horror",2 Seasons,2.9650769026687698
18457,James Johnson,80,India,s8735,Who the F**k Is That Guy?,"Documentaries, LGBTQ Movies, Music & Musicals",78 min,1.3724009312790375
11987,Alex Jones,41,Brazil,s4004,Burn Out,"Action & Adventure, International Movies",104 min,1.5726407187172964
10117,John Martinez,44,Australia,s399,Kingdom: Ashin of the North,"Horror Movies, International Movies, Thrillers",94 min,4.733438205314565
13069,Chris Brown,66,Canada,s5302,LEGO Elves: Secrets of Elvendale,Kids' TV,1 Season,3.8063913620655447
3360,Chris Miller,24,Japan,s4143,Russian Doll,"TV Comedies, TV Dramas",1 Season,3.892974185213773
6549,Sarah Brown,57,Canada,s3671,Cities of Last Things,"Dramas, Independent Movies, International Movies",106 min,2.6352538136404657
20553,Jane Miller,23,Germany,s2354,Chaman Bahaar,"Comedies, Dramas, International Movies",112 min,2.520019579972458
4324,Sarah Garcia,73,India,s3266,El sendero de la anaconda,"Documentaries, International Movies",74 min,4.624078942006456
11820,James Smith,64,Brazil,s2446,Chippa,"Comedies, Dramas, Independent Movies",92 min,3.1979563799179047
1690,Katie Davis,42,UK,s5990,13TH: A Conversation with Oprah Winfrey & Ava DuVernay,Movies,37 min,3.1592363857769463
941,Sarah Martinez,69,India,s2463,Dorohedoro,"Anime Series, International TV Shows",1 Season,2.0783922965410087
20827,James Brown,80,Mexico,s7129,Jewel's Catch One,"Documentaries, LGBTQ Movies",84 min,0.23044080672022849
15437,David Davis,38,Australia,s3155,Seven and a half dates,"Dramas, International Movies, Romantic Movies",107 min,1.4609638335987678
23158,Chris Hernandez,34,Brazil,s116,Bright Star,"Dramas, Romantic Movies",119 min,2.245148021914022
22331,James Miller,67,USA,s1448,Case 39,"Horror Movies, Thrillers",111 min,0.2487025654875663
6119,James Davis,62,Germany,s6723,Exit Wounds,Action & Adventure,101 min,3.7719034005605714
14638,Emma Williams,39,USA,s8163,Tellur Aliens,Children & Family Movies,67 min,4.9196509695751285
3071,Katie Smith,52,USA,s128,A Cinderella Story,"Children & Family Movies, Comedies",95 min,3.7049044027796714
21345,Jane Hernandez,40,India,s5480,The Keepers,"Crime TV Shows, Docuseries, TV Mysteries",1 Season,3.5058796462046535
7922,Alex Smith,35,Germany,s3704,El testigo,"Documentaries, International Movies",73 min,2.4331009095637413
6105,David Hernandez,31,USA,s7867,Rezeta,"Dramas, Independent Movies, International Movies",84 min,3.038032836874125
11715,Emma Williams,43,Brazil,s4161,Surga Yang Tak Dirindukan,"Dramas, Faith & Spirituality, International Movies",121 min,2.213195317582656
8168,Chris Johnson,69,Mexico,s4694,Pad Man,"Dramas, International Movies, Romantic Movies",130 min,3.419734091165074
7222,James Hernandez,25,USA,s1889,Good Game: The Beginning,"Dramas, International Movies, Sports Movies",115 min,3.875135020330378
13413,John Hernandez,51,France,s1024,Ajeeb Daastaans,"Dramas, Independent Movies, International Movies",142 min,4.156460174496499
22763,Jane Davis,32,Mexico,s8588,Thunderbolt,"Classic Movies, Documentaries",42 min,4.093313710132992
1504,Jane Martinez,73,France,s6743,Father Brown,"British TV Shows, Crime TV Shows, TV Dramas",6 Seasons,0.5369728060545503
5911,Emma Williams,64,UK,s539,The A List,"British TV Shows, International TV Shows, TV Dramas",2 Seasons,3.603743895686213
19837,Alex Jones,14,USA,s4295,The Theory of Everything,"Dramas, Romantic Movies",123 min,3.959476048735012
8503,Michael Miller,60,Brazil,s5980,1 Chance 2 Dance,"Dramas, Romantic Movies",89 min,3.879926439421693
9561,Emma Davis,68,Canada,s954,The Whole Truth,"Dramas, Thrillers",93 min,0.62462797458881
23618,Emma Johnson,42,UK,s363,The Lost Café,"Dramas, International Movies",76 min,1.7041340158799905
1855,John Hernandez,23,Germany,s4962,Rapture,Docuseries,1 Season,4.895362230049197
14777,Alex Garcia,63,France,s1294,Pitta Kathalu,"International TV Shows, TV Dramas",1 Season,4.851150598122415
4307,Emma Garcia,67,UK,s1386,Demon Slayer: Kimetsu no Yaiba,"Anime Series, International TV Shows",1 Season,3.2495890144863147
22497,Emma Williams,46,Brazil,s6151,An American in Madras,"Documentaries, International Movies",80 min,4.596023233836798
14017,John Jones,28,France,s6040,A Haunted House,"Comedies, Horror Movies",86 min,2.005082116525154
21894,Emma Hernandez,65,Germany,s6442,Chalay Thay Saath,"Comedies, Dramas, International Movies",118 min,1.6282364283316193
12675,Katie Smith,22,Japan,s5572,Asoka,"Action & Adventure, Dramas, International Movies",168 min,2.1665999351832705
19349,Emma Miller,45,Mexico,s7973,Secrets of Henry VIII's Palace: Hampton Court,"Documentaries, International Movies",54 min,0.03782519856804001
6590,Chris Johnson,33,Canada,s2766,Ladies Up,"International TV Shows, Stand-Up Comedy & Talk Shows, TV Comedies",1 Season,2.6344948462306537
16662,Katie Martinez,28,Mexico,s5795,Louis C.K.: Hilarious,Movies,,0.5568487475635836
13246,James Smith,19,France,s1748,Prospect,"Sci-Fi & Fantasy, Thrillers",100 min,1.967082242502276
6207,Katie Williams,55,France,s7096,Irada Pakka,"Comedies, Dramas, International Movies",137 min,2.464332314562596
22005,Emma Garcia,21,Japan,s4206,The Last Laugh,"Comedies, Dramas",99 min,3.8490979613227267
17026,David Martinez,51,Brazil,s3004,Fortune Feimster: Sweet & Salty,Stand-Up Comedy,61 min,2.8134825867802187
10335,Katie Jones,34,Canada,s2382,Last Flight to Abuja,"Dramas, International Movies",76 min,4.278636204327747
16321,Jane Garcia,73,UK,s5745,Containment,"TV Dramas, TV Thrillers",1 Season,1.40140316318076
1422,Chris Garcia,56,France,s4111,The Breaker Upperers,"Comedies, Independent Movies, International Movies",82 min,2.8820491484357422
12116,John Williams,26,Canada,s7329,Lockout,"Action & Adventure, International Movies, Sci-Fi & Fantasy",95 min,4.644930543679257
20382,Alex Martinez,69,India,s3138,Girls und Panzer,"Anime Series, International TV Shows",1 Season,4.927116091814777
14873,Sarah Williams,65,Canada,s2873,Unstoppable,"International TV Shows, Spanish-Language TV Shows, TV Dramas",1 Season,2.6253467660006438
15240,Emma Johnson,79,India,s1588,Detention,"International TV Shows, TV Dramas, TV Horror",1 Season,0.908214969958907
9332,Jane Smith,34,France,s4812,Recovery Boys,Documentaries,90 min,3.4335253279626827
12424,Chris Martinez,32,UK,s7000,Horror Story,"Horror Movies, International Movies",85 min,1.8192842741930915
19032,Chris Williams,72,Canada,s4515,FIGHTWORLD,Docuseries,1 Season,4.620158638043803
12360,Michael Johnson,54,Australia,s1112,Wild Child,"Comedies, Romantic Movies",98 min,0.3735140914932755
4804,Michael Johnson,41,Australia,s1351,Power Rangers Ninja Steel,Kids' TV,2 Seasons,0.9744802811153863
17781,David Hernandez,61,France,s1356,Love Daily,"Romantic TV Shows, Teen TV Shows",1 Season,3.7096622583735055
152,David Martinez,55,Australia,s1435,Leap!,"Children & Family Movies, Comedies",89 min,3.703859141449184
15605,Sarah Williams,59,Mexico,s4834,Alex Strangelove,"Comedies, Dramas, Independent Movies",100 min,1.9993841990374146
2885,Sarah Davis,64,India,s754,"Newly Rich, Newly Poor","International TV Shows, Romantic TV Shows, Spanish-Language TV Shows",1 Season,3.7084464745852936
16725,Jane Davis,54,India,s8552,The War: A Film by Ken Burns and Lynn Novick,Docuseries,1 Season,1.536341002411249
21944,Katie Smith,52,Canada,s8556,The Wedding Curse,"Horror Movies, International Movies",101 min,1.425981031224108
16248,Alex Jones,50,Australia,s5552,The Tenth Man,"Dramas, International Movies",81 min,1.5000481432056674
2921,Chris Smith,53,Brazil,s8224,The Brave One,"Dramas, Thrillers",122 min,4.571411844574069
22828,Jane Miller,41,Mexico,s5782,When I See You Again,"International TV Shows, Romantic TV Shows, TV Comedies",1 Season,2.6436274859870332
3313,Emma Brown,56,Germany,s4270,Jojo's World,"International TV Shows, Romantic TV Shows, TV Comedies",1 Season,0.8658027827536646
9204,John Johnson,47,UK,s5733,Love Now,"International TV Shows, Romantic TV Shows, TV Comedies",1 Season,1.1737318703227118
2328,Alex Jones,52,Japan,s3364,Shine On with Reese,"Docuseries, Stand-Up Comedy & Talk Shows",1 Season,1.387532828622053
2626,Katie Williams,46,Australia,s4535,Super Monsters Save Halloween,Children & Family Movies,25 min,4.021952949955837
1368,Emma Johnson,62,Australia,s1008,Motu Patlu in Octupus World,"Children & Family Movies, Comedies",81 min,4.884455921686763
3124,Katie Hernandez,34,USA,s5982,"10,000 B.C.",Action & Adventure,109 min,4.349216266515279
9092,Alex Hernandez,26,Australia,s3440,Home Is Where the Killer Is,"Dramas, Thrillers",87 min,3.9505345235506235
24267,Michael Johnson,80,Japan,s4203,Horrid Henry,"British TV Shows, Kids' TV, TV Comedies",2 Seasons,0.8271704649260964
23789,Sarah Hernandez,50,Germany,s5233,Kibaoh Klashers,Kids' TV,2 Seasons,1.2314681614408758
15699,Jane Davis,27,Germany,s1379,Penguin Bloom,"Children & Family Movies, Dramas",95 min,4.7760211891552595
3566,Alex Jones,35,Germany,s5915,Oscar's Oasis,Kids' TV,1 Season,4.170118463225089
2731,Michael Garcia,60,Germany,s1858,The Three Deaths of Marisela Escobedo,"Documentaries, International Movies",110 min,3.3602226410436824
22540,John Miller,67,Mexico,s1788,Metallica Through The Never,Music & Musicals,93 min,3.8984073435072824
18501,Jane Miller,41,India,s4829,Set It Up,"Comedies, Romantic Movies",106 min,1.555451329525489
22938,Alex Williams,52,Japan,s8396,The Little Prince,Children & Family Movies,107 min,3.9893528681317765
711,Jane Hernandez,50,Japan,s2163,The Rain,"International TV Shows, TV Dramas, TV Mysteries",3 Seasons,4.294624978073233
11638,Chris Martinez,71,India,s5695,White Girl,"Dramas, Independent Movies",90 min,0.7116353105560747
3073,Katie Johnson,54,USA,s5450,Catfight,"Comedies, Independent Movies",96 min,4.1529561090676586
15425,Emma Miller,44,Mexico,s4353,Angela's Christmas,Children & Family Movies,30 min,4.730839414618399
6370,David Davis,47,Australia,s6032,A Clockwork Orange,"Classic Movies, Cult Movies, Dramas",137 min,4.504630623807438
10491,David Johnson,29,UK,s2364,Wasp Network,"Dramas, International Movies, Thrillers",128 min,1.3011594153938804
6558,David Brown,46,France,s2284,Only,"Dramas, Independent Movies, Romantic Movies",97 min,0.04301832500491598
24322,Alex Brown,38,Brazil,s3174,Teasing Master Takagi-san,"Anime Series, International TV Shows, Romantic TV Shows",1 Season,0.6661664400346717
3694,David Martinez,49,India,s24,Go! Go! Cory Carson: Chrissy Takes the Wheel,Children & Family Movies,61 min,0.9686411641289905
19982,John Johnson,64,UK,s3753,Marvel's Jessica Jones,"Crime TV Shows, TV Action & Adventure, TV Dramas",3 Seasons,2.188984923233959
16304,Michael Jones,42,Mexico,s7161,Kaalia,"Action & Adventure, Dramas, International Movies",173 min,4.761648757500029
23713,Emma Garcia,34,Canada,s112,Sharkdog,Kids' TV,1 Season,3.328212132839857
1011,Michael Garcia,53,Brazil,s2910,Monster High: Electrified,Movies,72 min,2.1289334141528515
21646,John Jones,19,USA,s1580,Mr. Iglesias,"TV Comedies, Teen TV Shows",3 Seasons,1.217608259665219
2585,Alex Jones,38,Brazil,s8583,Thorne: Scaredy Cat,"Dramas, International Movies",125 min,3.1184633587666872
8353,Jane Davis,60,France,s7549,My True Friend,"Action & Adventure, Dramas, International Movies",108 min,2.274226518234535
23927,John Smith,49,France,s6617,Dismissed,Thrillers,87 min,1.1871310732917633
2006,Michael Martinez,48,India,s5324,What Happened to Monday,"Action & Adventure, Sci-Fi & Fantasy",124 min,3.4871662285458815
3063,Chris Brown,46,Australia,s2582,I Am Divine,"Documentaries, LGBTQ Movies",90 min,3.6460635347269803
968,John Smith,73,Canada,s8371,The Jack King Affair,"Documentaries, International Movies",52 min,1.6768956591661244
22388,Sarah Smith,38,USA,s406,Chhota Bheem - Dinosaur World,Children & Family Movies,65 min,2.932930182843933
3246,Alex Johnson,32,Japan,s3776,Cosmos Laundromat: First Cycle,"Dramas, International Movies, Sci-Fi & Fantasy",12 min,3.903497157362442
13709,Michael Jones,47,Germany,s7954,Scandal,"Crime TV Shows, TV Dramas",7 Seasons,2.718164871735062
21306,Alex Hernandez,18,Australia,s7632,Nymphomaniac: Volume II,"Dramas, Independent Movies, International Movies",124 min,2.5738863543900328
1721,James Martinez,68,India,s85,Omo Ghetto: the Saga,"Action & Adventure, Comedies, Dramas",147 min,1.3766224916398158
19466,Emma Garcia,23,India,s5854,Cyborg 009 VS Devilman,"Anime Series, International TV Shows",1 Season,3.0481169803380714
16485,John Hernandez,57,India,s535,Si Doel the Movie 2,"Dramas, International Movies",95 min,0.6690102403201736
13155,Alex Davis,52,Mexico,s3812,Dying to Tell,"Documentaries, International Movies",88 min,1.7232137686944298
20271,Chris Hernandez,52,Mexico,s5937,Shrek the Musical,"Children & Family Movies, Comedies, Music & Musicals",130 min,2.2276050015222317
13019,Katie Garcia,21,Australia,s7971,Secrets of Althorp - The Spencers,"Documentaries, International Movies",54 min,2.150263310046167
24030,Emma Johnson,67,India,s4622,Made in Mexico,"International TV Shows, Reality TV, Spanish-Language TV Shows",1 Season,2.7564131192029313
18757,Chris Williams,47,Australia,s8490,The River Wild,Action & Adventure,111 min,3.018902856183286
10419,Alex Jones,21,UK,s5808,Glitter Force,"Anime Series, Kids' TV",2 Seasons,2.123788914255362
15038,Katie Johnson,61,Mexico,s1915,Journey of an African Colony,"Docuseries, International TV Shows",1 Season,4.1018685456174655
