18225,John Davis,77,Mexico,s2120,Islands of Faith,"Documentaries, Faith & Spirituality, International Movies",88 min,4.748044302989113
1985,John Brown,78,Germany,s2353,Babies,"Docuseries, Science & Nature TV",2 Seasons,4.04386534038524
17241,Sarah Brown,47,Germany,s7055,Idiotest,"Reality TV, TV Comedies",1 Season,1.782669964289913
7980,Jane Williams,75,Brazil,s4526,Mo Amer: The Vagabond,Stand-Up Comedy,57 min,3.1426892069991337
1765,Jane Davis,38,Canada,s6110,Albion: The Enchanted Stallion,Children & Family Movies,106 min,4.505036948329087
4795,John Smith,25,Brazil,s3082,How High 2,Comedies,89 min,3.0746323733969345
2335,Alex Martinez,18,Germany,s1300,Thus Spoke Kishibe Rohan,"Anime Series, International TV Shows",1 Season,4.607163566791347
11636,Jane Martinez,19,France,s3633,Sleepless Society: Nyctophobia,"International TV Shows, TV Mysteries, TV Thrillers",1 Season,3.2809348691544877
13893,James Johnson,37,Canada,s2219,Norsemen,"International TV Shows, TV Comedies",3 Seasons,2.0750897156022043
4524,Alex Hernandez,68,Brazil,s3242,Nailed It! Holiday!,Reality TV,2 Seasons,4.39608393130095
21269,Michael Davis,71,UK,s6357,Bon Bini Holland,"Comedies, International Movies",88 min,3.5043289917585634
12919,Alex Johnson,38,Germany,s8056,Something's Gotta Give,"Comedies, Romantic Movies",128 min,1.8383036573090412
20121,Katie Miller,58,Canada,s7700,Palio,"Documentaries, International Movies, Sports Movies",91 min,3.7394041245362173
24616,James Davis,24,Mexico,s676,REA(L)OVE,"International TV Shows, Reality TV, Romantic TV Shows",1 Season,3.9759847646460047
14812,Chris Martinez,52,India,s5654,My Runway,"International TV Shows, Korean TV Shows, Romantic TV Shows",1 Season,4.344440729638468
6906,David Smith,16,Mexico,s6651,Driven to Dance,Dramas,99 min,0.4229075164025564
18625,Sarah Johnson,53,France,s7137,John Carter,"Action & Adventure, Sci-Fi & Fantasy",133 min,0.3570098155853235
16051,Chris Davis,27,France,s5678,Tokyo Trial,"International TV Shows, TV Dramas",1 Season,1.6790313872804958
17346,Sarah Martinez,31,Japan,s1401,Bling Empire,Reality TV,1 Season,1.1710720799980756
20802,John Miller,24,Germany,s5206,The Mist,"TV Dramas, TV Horror, TV Mysteries",1 Season,0.4630565898804545
10714,Alex Smith,47,Germany,s4895,Pocoyo Carnival,Movies,22 min,4.382882197189318
5192,Chris Davis,78,Germany,s5312,The Guardian Brothers,"Children & Family Movies, Comedies",86 min,1.6261382265836826
1181,Sarah Davis,72,India,s2716,Agneepath,"Dramas, International Movies",174 min,0.22607133812558022
2067,Emma Brown,76,India,s4752,Extinction,"Action & Adventure, Dramas, Sci-Fi & Fantasy",95 min,1.722839068563412
20121,Katie Miller,58,Canada,s2930,ROAD TO ROMA,"Documentaries, International Movies",73 min,4.143679331066131
5737,Sarah Jones,45,Germany,s2422,Merry Men 2: Another Mission,"Comedies, International Movies",115 min,0.6519333288799006
174,Katie Brown,18,Canada,s4161,Surga Yang Tak Dirindukan,"Dramas, Faith & Spirituality, International Movies",121 min,1.0316910464253015
6836,Chris Garcia,41,Mexico,s4381,La Doña,"Spanish-Language TV Shows, TV Dramas",1 Season,1.1304195645887893
151,Katie Martinez,34,UK,s1873,The Forty-Year-Old Version,"Comedies, Dramas, Independent Movies",124 min,2.7517492131211174
8987,Chris Smith,50,Germany,s6738,Famous in Ahmedabad,"Documentaries, International Movies",29 min,1.121354850679979
2324,Katie Brown,72,Mexico,s1003,Tell Me When,"Comedies, International Movies",97 min,2.103279447678126
23217,John Smith,64,India,s1548,Teen Mom 2,Reality TV,2 Seasons,2.8250709224277815
21822,Chris Garcia,52,Australia,s8583,Thorne: Scaredy Cat,"Dramas, International Movies",125 min,4.7516707191201215
8874,James Johnson,14,Germany,s1484,A Love So Beautiful,"International TV Shows, Romantic TV Shows, TV Comedies",1 Season,0.25905558811616936
4998,Emma Smith,55,Mexico,s2391,How to Get Away with Murder,"Crime TV Shows, TV Dramas, TV Mysteries",6 Seasons,2.944541569010531
15119,David Martinez,68,Brazil,s2157,Tiny Creatures,"Docuseries, Science & Nature TV, TV Action & Adventure",1 Season,2.334956826480825
2306,James Smith,38,France,s3822,Dennis and Gnasher Unleashed,"British TV Shows, Kids' TV, TV Comedies",1 Season,3.247039007805178
488,Jane Johnson,52,USA,s5500,Chaahat,"Dramas, International Movies, Romantic Movies",148 min,0.04751993173306823
386,Katie Brown,31,India,s8439,The New Romantic,"Comedies, Independent Movies, Romantic Movies",82 min,3.7091756320051057
19510,Michael Brown,31,India,s8797,Yunus Emre,"International TV Shows, TV Dramas",2 Seasons,1.8089241000163503
8362,Michael Jones,15,UK,s5810,XOXO,"Dramas, Music & Musicals",92 min,2.5945322430168187
12395,Alex Brown,77,Canada,s1397,Homefront,Action & Adventure,100 min,4.538340991686878
4969,Michael Garcia,72,Japan,s4898,Pocoyo Special Sports,Movies,24 min,3.8909836587894677
17803,Emma Davis,69,Australia,s7019,How to Make an American Quilt,"Dramas, Romantic Movies",116 min,1.787991065493613
18795,Sarah Davis,45,Mexico,s7533,My Brother ... Nikhil,"Dramas, Independent Movies, International Movies",116 min,4.612376015965321
23929,Katie Davis,25,Germany,s2724,Friendship,"Action & Adventure, Dramas, International Movies",161 min,4.016305461673926
7132,Michael Williams,65,UK,s1427,Gangaajal,"Dramas, International Movies",148 min,4.786206130585691
9478,Michael Hernandez,20,Mexico,s7153,Just Friends,"Comedies, Romantic Movies",94 min,2.136151290334822
23211,Jane Smith,62,France,s4996,Ladies First,"Documentaries, International Movies, Sports Movies",40 min,3.9455818130833014
13813,Michael Williams,18,USA,s1087,Ojukokoro: Greed,"Dramas, International Movies, Thrillers",108 min,0.7129999485548782
11304,David Miller,57,Mexico,s5985,100% Hotter,"British TV Shows, International TV Shows, Reality TV",1 Season,2.8361609965375285
8780,Alex Hernandez,60,Mexico,s4388,Vai Anitta,"Docuseries, International TV Shows, Reality TV",1 Season,0.46091327262889004
17990,Katie Martinez,67,Mexico,s8618,Trash,"Dramas, Independent Movies, Thrillers",114 min,0.5491422927730244
18452,David Hernandez,23,Germany,s4376,Target,"Comedies, Horror Movies, International Movies",91 min,4.920239740632562
4135,Katie Garcia,62,Canada,s131,Barbie Big City Big Dreams,"Children & Family Movies, Music & Musicals",63 min,3.288442983004132
19217,Jane Hernandez,27,India,s1074,Motu Patlu Kung Fu Kings 4 The Challenge of Kung Fu Brothers,"Children & Family Movies, Music & Musicals",86 min,2.2613444717666424
11314,John Smith,71,Canada,s6288,Best Neighbors,"Comedies, International Movies",98 min,1.272322203706016
21615,Chris Garcia,45,Brazil,s8238,The Car,"Cult Movies, Horror Movies",96 min,0.8186524380825011
9707,Sarah Johnson,35,France,s6390,"Bure Kaam Bura Natija, Kyun Bhai Chacha Haan Bhatija",Kids' TV,1 Season,4.7442454960107225
2908,Emma Brown,28,UK,s4290,Dragons: Dawn of the Dragon Racers,"Children & Family Movies, Comedies",27 min,2.611411320895431
11181,Sarah Miller,56,Japan,s3392,The Command,"Dramas, International Movies, Thrillers",118 min,2.382793983242431
15844,Emma Hernandez,72,India,s7603,NOVA: Chinese Chariot Revealed,Documentaries,54 min,0.38044133205907105
24989,Katie Garcia,27,Brazil,s2864,There Will Be Blood,"Dramas, Independent Movies",158 min,4.012471086302992
9008,Alex Davis,77,Australia,s3404,Mighty Little Bheem: Diwali,"Kids' TV, TV Comedies",1 Season,3.8313207862525536
18414,Michael Garcia,35,Germany,s35,Tayo and Little Wizards,Kids' TV,1 Season,0.05923266136005079
16348,David Williams,26,Mexico,s6880,Good People,"Action & Adventure, Thrillers",90 min,3.1945825418824314
9663,Jane Williams,71,Japan,s4412,Bucket List,"Dramas, International Movies",129 min,2.6978804336997437
16321,Jane Garcia,73,UK,s3541,Moving Art,"Docuseries, Science & Nature TV",3 Seasons,0.6629185615620153
21021,Chris Miller,52,India,s2363,The Politician,"TV Comedies, TV Dramas, Teen TV Shows",2 Seasons,0.21024248289479297
1227,John Martinez,64,Australia,s4363,Bumping Mics with Jeff Ross & Dave Attell,"Stand-Up Comedy & Talk Shows, TV Comedies",1 Season,3.9792099534760093
11146,Sarah Garcia,59,India,s3513,Sebastian Maniscalco: What's Wrong with People?,Stand-Up Comedy,76 min,2.934420597774781
12643,John Johnson,77,Canada,s4229,Whitney Cummings: Money Shot,Stand-Up Comedy,48 min,1.3319487654501827
6815,James Jones,37,Australia,s4171,Polar,"Action & Adventure, International Movies",119 min,1.3783358412800268
19825,David Hernandez,43,UK,s5378,To the Bone,"Dramas, Independent Movies",108 min,3.5072468259871674
16454,Michael Davis,41,Canada,s2944,The Ballad of Lefty Brown,Dramas,112 min,2.197809739684068
13241,Sarah Garcia,45,Australia,s7676,Operation Proposal,"International TV Shows, Korean TV Shows, Romantic TV Shows",1 Season,0.5146845241969294
22909,Katie Davis,60,Australia,s310,Car Masters: Rust to Riches,Reality TV,3 Seasons,0.29187472581616747
3410,Chris Davis,23,Canada,s323,You're My Destiny,"International TV Shows, Romantic TV Shows, TV Comedies",1 Season,1.7144232916795783
15838,Sarah Hernandez,46,Canada,s3889,Loving is Losing,"Comedies, International Movies, Romantic Movies",91 min,2.373558780650477
8170,John Williams,19,France,s8021,Silver Spoon,"Crime TV Shows, International TV Shows, TV Action & Adventure",2 Seasons,3.60057066859746
1956,Katie Miller,76,Canada,s2527,She-Ra and the Princesses of Power,"Kids' TV, TV Action & Adventure, TV Sci-Fi & Fantasy",5 Seasons,0.23384814433056955
5053,Katie Smith,72,Mexico,s5603,Rush: Beyond the Lighted Stage,"Documentaries, Music & Musicals",107 min,3.4358177063126027
9285,John Johnson,60,Japan,s4633,The Good Cop,"Crime TV Shows, TV Comedies, TV Dramas",1 Season,2.828682937236276
7814,Sarah Miller,32,Australia,s5981,1 Mile to You,"Dramas, Romantic Movies, Sports Movies",105 min,1.9835056935292161
7256,Chris Smith,38,Germany,s4003,Bombairiya,"Comedies, Dramas, International Movies",108 min,3.3832151925917446
2157,Katie Brown,67,Canada,s1592,Captain Underpants Mega Blissmas,"Children & Family Movies, Comedies",46 min,3.166615477394737
23506,Katie Garcia,28,Japan,s5230,Bomb Scared,"Comedies, Independent Movies, International Movies",89 min,1.1076932483000868
15661,Katie Johnson,40,Germany,s6632,Don't Look Down,"Documentaries, International Movies",93 min,2.740226838014856
22866,Sarah Johnson,68,USA,s2417,The Night Clerk,"Dramas, Independent Movies",90 min,3.287248477243761
9452,David Davis,57,UK,s2647,My Stupid Boss,"Comedies, International Movies",107 min,0.989014152368457
18506,Jane Miller,39,France,s2938,Dragons: Rescue Riders,"Kids' TV, TV Comedies",2 Seasons,1.1036025543170918
19477,Alex Miller,58,France,s3028,Leslie Jones: Time Machine,Stand-Up Comedy,66 min,1.859138182104057
14942,John Brown,58,Brazil,s3874,Munafik 2,"Horror Movies, International Movies",104 min,0.5186496465888984
4959,Katie Jones,37,USA,s7286,Legends of Strength,Docuseries,1 Season,0.8819995327959362
8176,Jane Martinez,67,India,s7772,Power Rangers RPM,Kids' TV,1 Season,0.4514025744625849
10846,James Martinez,61,Australia,s3977,The Eagle of El-Se'eed,"Crime TV Shows, International TV Shows, TV Action & Adventure",1 Season,4.583308792745921
12083,David Williams,56,Japan,s5763,Be with Me,"International TV Shows, Romantic TV Shows, TV Dramas",1 Season,1.854156178234867
10313,John Brown,20,USA,s19,Intrusion,Thrillers,94 min,2.7069618556461457
3015,Alex Miller,80,India,s5283,Carrie Pilby,"Comedies, Dramas",98 min,3.6369632113529935
19144,Chris Garcia,31,Japan,s6828,Gargantia on the Verdurous Planet,"Anime Series, International TV Shows",1 Season,2.8551294977879706
17019,David Johnson,43,Germany,s2709,El Reemplazante,"International TV Shows, Spanish-Language TV Shows, TV Dramas",2 Seasons,2.0831901409115487
23359,Alex Williams,67,Germany,s2017,Ani... Dr. Kashinath Ghanekar,"Dramas, International Movies",157 min,2.6277509976036355
21185,John Brown,56,UK,s163,Marshall,Dramas,118 min,0.8972969962216804
18190,David Williams,59,Germany,s768,Creator's File: GOLD,"International TV Shows, TV Comedies",1 Season,2.2833013553810195
975,Chris Garcia,66,Canada,s108,A Champion Heart,"Children & Family Movies, Dramas",90 min,2.2935934534546387
4063,Jane Williams,46,UK,s5938,The Short Game,"Children & Family Movies, Documentaries, Sports Movies",100 min,3.13039282229714
10963,Chris Martinez,49,Mexico,s1686,Ainu Mosir,"Dramas, International Movies",84 min,0.6143614834714423
22014,Michael Johnson,53,Japan,s8468,The Prison,"Action & Adventure, Dramas, International Movies",125 min,2.464969430238788
7014,James Martinez,73,Germany,s1543,Vir Das: Outside In - The Lockdown Special,Stand-Up Comedy,50 min,4.63727220376356
15643,Katie Hernandez,65,Japan,s4348,Roll With Me,"Documentaries, Sports Movies",90 min,0.34790840220912445
20964,Chris Miller,33,Japan,s1008,Motu Patlu in Octupus World,"Children & Family Movies, Comedies",81 min,3.2108010882673805
2717,Alex Garcia,18,Japan,s7825,Raja Hindustani,"Dramas, International Movies, Romantic Movies",177 min,1.0310090651064203
15750,Emma Hernandez,13,UK,s2887,Pete Davidson: Alive From New York,Stand-Up Comedy,50 min,2.4166131796727623
9825,John Jones,45,Germany,s8110,Strongland,"Docuseries, International TV Shows",1 Season,4.366584642158927
7138,Alex Jones,15,Germany,s5854,Cyborg 009 VS Devilman,"Anime Series, International TV Shows",1 Season,4.916108162602532
1785,David Davis,49,Germany,s1015,PJ Masks,Kids' TV,3 Seasons,4.871917498383213
14170,Sarah Jones,49,Australia,s3494,Oh! Baby (Tamil),"Comedies, International Movies, Music & Musicals",146 min,2.3542394892222394
15979,Emma Johnson,62,Japan,s3424,Black Money Love,"Crime TV Shows, International TV Shows, TV Dramas",1 Season,2.5373913052388213
3300,Chris Jones,21,Germany,s8364,The Intent,"Dramas, International Movies, Thrillers",99 min,0.5922834157311496
22282,Emma Williams,29,Brazil,s3740,Luckee,"Comedies, International Movies, Romantic Movies",113 min,1.9792481389043908
11722,Michael Jones,13,UK,s4699,To All the Boys I’ve Loved Before,"Comedies, International Movies, Romantic Movies",100 min,2.681494182625582
13212,Emma Smith,58,Canada,s5471,Bloodline,"TV Dramas, TV Mysteries, TV Thrillers",3 Seasons,1.930276746637133
9910,Jane Martinez,71,France,s6711,Evan Almighty,"Children & Family Movies, Comedies, Faith & Spirituality",96 min,2.2486003220849455
8197,David Williams,75,Australia,s1166,Pagglait,"Comedies, Dramas, International Movies",114 min,4.109601967259712
16965,John Jones,18,Japan,s6183,"Aram, Aram","Dramas, Independent Movies",79 min,1.594503747174822
328,Emma Martinez,59,Canada,s293,Quartet,"Comedies, Dramas, Independent Movies",98 min,4.5006140798120855
13274,Emma Martinez,68,Germany,s1085,Heaven Official's Blessing,"Anime Series, International TV Shows, Romantic TV Shows",1 Season,1.2426930554387154
1178,Jane Smith,30,Germany,s5938,The Short Game,"Children & Family Movies, Documentaries, Sports Movies",100 min,1.3124551722643214
5692,Jane Garcia,26,India,s2493,The Witness Who Didn't See Anything,"Comedies, International Movies",157 min,3.72850348239594
24473,Chris Williams,14,USA,s2564,Luccas Neto em: Acampamento de Férias 2,"Children & Family Movies, Comedies, Music & Musicals",81 min,1.6601449648400823
1998,Alex Jones,37,USA,s5251,What She Put on the Table,"International TV Shows, TV Dramas",1 Season,2.520529550531689
20610,Emma Williams,22,UK,s511,Between,"International TV Shows, TV Dramas, TV Mysteries",2 Seasons,4.4578907249667745
1236,Jane Martinez,37,UK,s8270,The Daughter,Dramas,95 min,4.575429079003256
23622,John Brown,78,Canada,s2647,My Stupid Boss,"Comedies, International Movies",107 min,0.6209102355336399
14496,Chris Hernandez,55,Brazil,s3733,The Edge of Democracy,"Documentaries, International Movies",122 min,1.7189264899008716
963,Jane Hernandez,58,UK,s3580,Green Frontier,"Crime TV Shows, International TV Shows, Spanish-Language TV Shows",1 Season,0.05966704088715746
18260,Sarah Smith,46,Japan,s7327,"Lock, Stock and Two Smoking Barrels","Action & Adventure, Comedies, Independent Movies",108 min,1.9973555444317088
18870,David Smith,17,India,s4077,She's Dating the Gangster,"Dramas, International Movies, Romantic Movies",113 min,2.6959847270190473
7782,David Davis,73,UK,s6278,Beiimaan Love,"Dramas, International Movies, Romantic Movies",115 min,4.433283472216841
4761,Chris Jones,14,Japan,s2992,Rise of Empires: Ottoman,Docuseries,1 Season,4.962406573849185
294,Katie Davis,40,Brazil,s2355,Destiny,"Dramas, International Movies",136 min,4.123638121163824
24447,James Johnson,77,Mexico,s3223,Mythomaniac,"International TV Shows, TV Comedies, TV Dramas",1 Season,3.2239136311745358
17600,Emma Davis,52,Canada,s1937,Welcome to Sudden Death,Action & Adventure,80 min,2.843610960740171
17855,James Garcia,24,Australia,s2903,DreamWorks Shrek's Swamp Stories,"Kids' TV, TV Action & Adventure, TV Comedies",1 Season,3.427094452670465
16225,Alex Miller,68,Canada,s6862,God's Not Dead,"Dramas, Faith & Spirituality",113 min,1.9031130468809354
18438,John Jones,47,France,s2679,Jem and the Holograms,"Children & Family Movies, Dramas, Music & Musicals",119 min,0.570724710186864
8228,Emma Hernandez,21,Japan,s4178,IO,"Dramas, Sci-Fi & Fantasy",96 min,1.0336630814407843
13395,Jane Johnson,14,Australia,s2546,Andaz Apna Apna,"Action & Adventure, Comedies, Cult Movies",160 min,3.078382031519032
15043,John Martinez,22,Canada,s5892,Beasts of No Nation,"October 16, 2015",United States,4.168911265427883
11567,Katie Hernandez,70,UK,s3325,The Massively Mixed-Up Middle School Mystery,"Children & Family Movies, Comedies",40 min,3.8937525642892568
15283,Jane Miller,75,India,s7919,Sadqay Tumhare,"International TV Shows, Romantic TV Shows, TV Dramas",1 Season,1.4490946201082728
11541,David Smith,27,Japan,s8484,The Rezort,"Horror Movies, International Movies",90 min,3.996536234416111
1996,Jane Brown,77,Japan,s7650,Ollie & Moon,Kids' TV,1 Season,2.427610050841405
21909,Chris Davis,70,UK,s4536,YG Future Strategy Office,"International TV Shows, Korean TV Shows, TV Comedies",1 Season,1.4953250319501221
19472,Chris Brown,55,Brazil,s6869,Goldie & Bear,Kids' TV,2 Seasons,2.348975428808022
9980,John Miller,41,Australia,s2473,Betaal,"International TV Shows, TV Action & Adventure, TV Horror",1 Season,3.3134949511003104
12595,Alex Miller,42,USA,s5661,Gabriel lglesias: I’m Sorry For What I Said When I Was Hungry,Stand-Up Comedy,88 min,0.8214380376787533
17654,Chris Jones,49,France,s4844,Pedal the World,"Documentaries, International Movies, Sports Movies",85 min,1.8227481852362903
24011,Emma Smith,80,France,s6295,Bh Se Bhade,"International TV Shows, TV Comedies",1 Season,1.0553149193472677
11499,Chris Williams,50,Germany,s3567,Saavat,"Dramas, Independent Movies, International Movies",118 min,0.6237420095543322
18892,Michael Garcia,29,Japan,s1387,So My Grandma’s a Lesbian!,"Comedies, International Movies, LGBTQ Movies",95 min,2.4047935226111554
17956,Jane Brown,35,Australia,s8462,The Polar Express,Children & Family Movies,100 min,1.8621869351711828
22866,Sarah Johnson,68,USA,s7714,Patient Seventeen,Documentaries,68 min,3.917598351884713
2663,Katie Brown,69,Brazil,s315,Heavy,"Dramas, Independent Movies, Romantic Movies",104 min,0.4227093744954369
7154,Jane Martinez,29,Canada,s8294,The Fear,"British TV Shows, Crime TV Shows, TV Dramas",1 Season,2.6915586839730294
1829,Jane Brown,75,Australia,s5075,Bad Day for the Cut,"Independent Movies, International Movies, Thrillers",99 min,4.951124351216941
12711,David Smith,42,Japan,s1404,Double Dad,"Children & Family Movies, Comedies, Dramas",105 min,1.8326810429493756
22022,Jane Miller,40,Mexico,s1209,Çarsi Pazar,"Comedies, International Movies",97 min,1.4969543303078199
3842,Sarah Brown,69,UK,s1003,Tell Me When,"Comedies, International Movies",97 min,0.9134957838762525
1025,John Garcia,30,India,s5785,Iliza Shlesinger: Confirmed Kills,Stand-Up Comedy,78 min,2.334018316735
3316,John Hernandez,21,Germany,s7971,Secrets of Althorp - The Spencers,"Documentaries, International Movies",54 min,1.550721780803856
16932,Michael Smith,13,UK,s2295,Desperados,"Comedies, Romantic Movies",107 min,3.125322036856677
4890,Katie Smith,60,Germany,s5728,Inborn Pair,"International TV Shows, Romantic TV Shows, TV Comedies",1 Season,4.104801604490587
19865,Emma Martinez,66,Australia,s6918,Hannibal,"TV Horror, TV Mysteries, TV Thrillers",3 Seasons,4.937798381635542
23455,James Smith,53,Canada,s5753,Spotless,"Crime TV Shows, International TV Shows, TV Dramas",1 Season,0.8138544208233839
11269,John Miller,37,Canada,s747,Awake,"Dramas, Thrillers",97 min,1.081921691570093
23160,David Miller,26,Germany,s7278,LeapFrog: Phonics Farm,Movies,35 min,1.155288328712993
6216,John Williams,33,Brazil,s7247,Kurtulus Son Durak,"Comedies, Dramas, International Movies",100 min,3.3060201002831673
23402,Katie Jones,69,USA,s3376,Monzón: A Knockout Blow,"Crime TV Shows, International TV Shows, Spanish-Language TV Shows",1 Season,4.2906260325896275
4055,David Jones,27,Canada,s1169,DOTA: Dragon's Blood,Anime Series,1 Season,2.1263068717393594
17649,James Brown,57,USA,s5289,A Boy Name Flora A,"International TV Shows, TV Comedies, TV Dramas",1 Season,3.8676395719526164
22950,Emma Jones,13,Mexico,s8749,Winter of Our Dreams,"Classic Movies, Dramas",86 min,0.3482383573783465
18335,Michael Miller,15,Germany,s6404,Calendar Girls,"Dramas, International Movies",126 min,4.422395064568024
12924,Michael Williams,42,UK,s3574,Our Planet - Behind The Scenes,Documentaries,63 min,4.490972220096419
10613,John Miller,58,Brazil,s8544,The Unborn Child,"Horror Movies, International Movies",93 min,0.8962103010245243
17702,Sarah Martinez,21,Australia,s277,Valeria,"International TV Shows, Romantic TV Shows, Spanish-Language TV Shows",2 Seasons,0.6014188416560884
23759,Alex Johnson,80,Germany,s2594,Thomas & Friends: Marvelous Machinery: A New Arrival,Children & Family Movies,23 min,0.7193172687459204
457,Michael Hernandez,66,Brazil,s3335,Drive,"Action & Adventure, International Movies",119 min,3.7938500987517005
10573,Jane Brown,71,Japan,s6773,Follow Me,"Documentaries, International Movies",86 min,4.217476701216891
17596,Chris Johnson,27,India,s5496,Simplemente Manu NNa,Stand-Up Comedy,72 min,2.8992658770430033
19767,Katie Jones,43,Germany,s1109,Irul,"International Movies, Thrillers",91 min,3.112756381491545
3911,Alex Hernandez,24,India,s4801,Tum Milo Toh Sahi,"Comedies, Dramas, International Movies",128 min,4.819326987903171
7026,John Hernandez,43,UK,s560,Air Force One,Action & Adventure,125 min,2.5774031587617325
7195,Katie Jones,52,USA,s482,How I Became a Superhero,"Action & Adventure, Dramas, International Movies",101 min,4.402895215643566
10391,Alex Garcia,45,USA,s525,Midnight Diner: Tokyo Stories,"International TV Shows, TV Dramas",2 Seasons,2.8521662035839297
2257,Jane Hernandez,69,India,s3400,In My Country,"Dramas, International Movies",99 min,0.709704758127162
24464,Sarah Brown,43,UK,s108,A Champion Heart,"Children & Family Movies, Dramas",90 min,1.1591551428174274
14954,Alex Brown,63,Germany,s4524,Blood Pact,"Crime TV Shows, International TV Shows, TV Dramas",1 Season,3.8522533489676554
14184,John Johnson,48,Germany,s2054,Young Wallander,"Crime TV Shows, International TV Shows, TV Dramas",1 Season,4.890336429628018
6555,Michael Jones,16,UK,s3347,The House of Flowers Presents: The Funeral,Movies,36 min,1.7795591222270875
8343,Emma Garcia,51,France,s2329,Ride Like a Girl,"Children & Family Movies, Dramas, Independent Movies",99 min,2.84439842753778
16971,Emma Williams,40,Germany,s1319,To All The Boys: Always And Forever,"Comedies, Romantic Movies",116 min,2.4898866352830877
13863,Alex Martinez,52,Germany,s2625,5Gang,"Comedies, International Movies",96 min,3.687974639258671
19370,Chris Garcia,45,Japan,s8241,The Cell,"Action & Adventure, Dramas, International Movies",126 min,4.086873894759974
23723,James Davis,64,Canada,s2427,BAKI,"Anime Series, International TV Shows",3 Seasons,1.703672801772424
14626,John Miller,34,Canada,s6041,A Haunting at Silver Falls: The Return,"Horror Movies, Independent Movies",80 min,3.22142159103296
1727,David Miller,44,Canada,s5302,LEGO Elves: Secrets of Elvendale,Kids' TV,1 Season,4.153272274662856
18225,John Davis,77,Mexico,s2389,Alexa & Katie,"Kids' TV, TV Comedies",4 Seasons,2.4127127393026515
19211,Alex Garcia,57,France,s6686,Elles ont toutes une histoire,"Documentaries, International Movies",49 min,3.4645350720782138
10612,Katie Jones,53,France,s533,Scream,"Crime TV Shows, TV Horror, TV Mysteries",3 Seasons,2.445904110829874
16777,Alex Williams,17,USA,s6395,Bushwick,"Action & Adventure, Independent Movies",94 min,3.315564713862875
16510,James Smith,49,Mexico,s4541,Eric ldle's What About Dick?,"Comedies, Music & Musicals",81 min,2.1025392993354135
12221,James Garcia,53,Japan,s731,Cobra Kai - The Afterparty,Movies,34 min,3.7036912849818333
9664,Emma Martinez,69,India,s5485,Natascha Kampusch: The Whole Story,Movies,51 min,4.491376892407895
925,Katie Brown,78,France,s241,The Witcher: Nightmare of the Wolf,"Action & Adventure, Anime Features",84 min,2.7512535991163842
553,Katie Hernandez,27,UK,s7284,Legend of the Naga Pearls,"Action & Adventure, International Movies, Sci-Fi & Fantasy",108 min,2.7340536289783945
60,Chris Smith,49,Australia,s6370,Brampton's Own,"Dramas, Romantic Movies, Sports Movies",90 min,3.5284836152793924
23271,Katie Brown,46,USA,s1972,Bhaji In Problem,"Comedies, International Movies",117 min,2.8680875291961367
4470,Katie Smith,35,Germany,s4127,Hidden Worlds,"Crime TV Shows, International TV Shows, TV Dramas",1 Season,2.536775455797061
10941,John Hernandez,17,France,s8412,The Making of Frozen Planet,"British TV Shows, Docuseries, Science & Nature TV",1 Season,4.967337616381302
14176,Katie Martinez,24,Japan,s8404,The Look of Silence,"Documentaries, International Movies",103 min,3.000302454035866
7315,Sarah Hernandez,37,UK,s2948,Arrow,"Crime TV Shows, TV Action & Adventure",8 Seasons,3.3381375802682145
5400,Michael Garcia,74,Canada,s2043,Cleverman,"TV Dramas, TV Sci-Fi & Fantasy, TV Thrillers",1 Season,2.2077431530276277
