19444,Sarah Johnson,57,India,s2841,Angu Vaikuntapurathu (Malayalam),"Action & Adventure, Comedies, Dramas",162 min,2.4103967109727202
744,Michael Williams,76,Canada,s2054,Young Wallander,"Crime TV Shows, International TV Shows, TV Dramas",1 Season,2.52232703641742
20181,John Johnson,27,Canada,s5047,Valor,"TV Action & Adventure, TV Dramas",1 Season,3.5259489538712554
13436,David Smith,25,India,s8568,The Year of Happiness and Love,"International TV Shows, Romantic TV Shows, TV Comedies",1 Season,1.9000836307041151
18812,Chris Martinez,21,Mexico,s2539,Wedy Atkalam,"Comedies, Dramas, International Movies",72 min,4.172681134917172
5371,John Davis,75,France,s7916,Sadece Sen,"Dramas, International Movies, Romantic Movies",105 min,4.162298174303428
18813,John Brown,14,Canada,s8469,The Pursuit,Documentaries,76 min,2.1352659747335374
3949,David Johnson,53,Japan,s3439,After,"Dramas, Romantic Movies",106 min,1.1047891899517244
8583,John Williams,52,Australia,s2879,Couple of Days,"Dramas, International Movies, Romantic Movies",103 min,4.778199127452407
18127,James Williams,64,Mexico,s4095,Genius,"Dramas, Independent Movies, International Movies",96 min,1.2951082562610368
9802,Emma Williams,80,Japan,s4477,Terrorism Close Calls,"Crime TV Shows, Docuseries, International TV Shows",1 Season,2.9006842050407213
3015,Alex Miller,80,India,s5527,Bibi & Tina,"Children & Family Movies, Music & Musicals",97 min,3.292188033914635
18549,James Jones,52,India,s8138,Swami Baba Ramdev: The Untold Story,"International TV Shows, TV Dramas",1 Season,0.18577256962979571
3055,Alex Miller,64,Japan,s4920,Kevin James: Never Don't Give Up,Stand-Up Comedy,62 min,1.2576362091291626
1419,James Williams,49,India,s4888,Coffee for All,"Documentaries, International Movies",69 min,4.171232016302804
16474,Jane Martinez,59,Mexico,s2680,Maurício Meirelles: Generating Chaos,Stand-Up Comedy,63 min,1.8336823765432986
3607,Jane Garcia,55,USA,s6876,Good Kill,Dramas,103 min,4.899703330855012
16360,Alex Hernandez,57,UK,s6154,An American Tail: The Mystery of the Night Monster,Children & Family Movies,75 min,2.185151638371399
12760,David Davis,32,UK,s4928,Beyond Skyline,"Action & Adventure, Sci-Fi & Fantasy",107 min,3.0467278877629966
9604,Emma Smith,65,Mexico,s7009,Hotel Transylvania 3: Summer Vacation,"Children & Family Movies, Comedies",97 min,3.030953873201994
24125,James Garcia,54,Mexico,s1093,Dolly Parton: A MusiCares Tribute,"Documentaries, Music & Musicals",55 min,4.019680795371634
19424,Sarah Williams,47,USA,s4004,Burn Out,"Action & Adventure, International Movies",104 min,4.7049756784707055
13414,Chris Johnson,19,USA,s1046,Next in Fashion,Reality TV,1 Season,0.04715201612806641
1521,Sarah Johnson,37,Japan,s1412,What Would Sophia Loren Do?,32 min,TV-14,0.6258000427913663
3978,John Jones,19,Mexico,s8019,Silent Hill: Revelation,Horror Movies,94 min,0.4680067954385403
10172,Sarah Jones,20,Germany,s5460,Off Camera,Stand-Up Comedy & Talk Shows,3 Seasons,4.282417530913088
2650,Jane Jones,41,UK,s5341,LEGO Marvel Super Heroes: Avengers Reassembled!,Children & Family Movies,22 min,3.6644381402772206
13591,Sarah Smith,70,Mexico,s1912,Human Nature,Documentaries,95 min,0.928033936745411
23297,Michael Davis,74,Mexico,s8133,Surviving R. Kelly Part II: The Reckoning,"Crime TV Shows, Docuseries",1 Season,2.5158005411424234
6859,Alex Williams,23,UK,s5617,Dilwale,"Action & Adventure, Dramas, International Movies",154 min,3.890219752688152
14437,Jane Smith,49,Australia,s5432,The Russian Revolution,Documentaries,47 min,3.122411139411543
24214,Alex Miller,55,USA,s1130,Secrets of Great British Castles,"British TV Shows, Docuseries, International TV Shows",2 Seasons,0.09593867806305889
19456,James Martinez,47,France,s3812,Dying to Tell,"Documentaries, International Movies",88 min,2.3313545801423934
10467,James Garcia,55,Mexico,s7662,One Direction: This Is Us,"Documentaries, Music & Musicals",92 min,1.0230886896120457
1286,Michael Johnson,44,USA,s8083,Star Wars: Episode VIII: The Last Jedi,"Action & Adventure, Children & Family Movies, Sci-Fi & Fantasy",152 min,3.5837236149183624
16542,Katie Williams,46,Canada,s4972,Layla M.,"Dramas, International Movies",99 min,1.4320109780658936
5064,David Miller,75,UK,s3284,The Yard,"Crime TV Shows, International TV Shows, TV Dramas",2 Seasons,2.1650169887433703
12230,James Brown,28,Germany,s6481,Christmas with the Kranks,"Children & Family Movies, Comedies",99 min,4.524656013972127
21889,Katie Davis,65,Brazil,s5471,Bloodline,"TV Dramas, TV Mysteries, TV Thrillers",3 Seasons,3.8892819798791045
2027,Alex Garcia,75,Brazil,s8423,The Mind of a Chef,Docuseries,5 Seasons,2.7384844073053314
1317,Alex Hernandez,48,France,s749,"Fresh, Fried & Crispy",Reality TV,1 Season,2.843522843883462
8243,Michael Davis,71,Australia,s5317,Buster's Mal Heart,"Independent Movies, Thrillers",98 min,2.2879838904702106
128,John Martinez,70,Brazil,s5332,Naked,"Comedies, Romantic Movies",97 min,4.260498369736495
11135,Emma Brown,37,UK,s7949,Save Our Shelter,Reality TV,1 Season,1.2123043702160414
16327,Katie Johnson,14,Brazil,s1937,Welcome to Sudden Death,Action & Adventure,80 min,1.529627090552132
710,Chris Johnson,13,USA,s3528,"The Mind, Explained","Docuseries, Science & Nature TV",1 Season,1.7025345786631008
22311,James Jones,73,Brazil,s6506,Club Friday The Series 7,"International TV Shows, Romantic TV Shows, TV Dramas",7 Seasons,4.940906206673882
1920,Emma Smith,61,USA,s3081,Benchwarmers 2: Breaking Balls,"Comedies, Sports Movies",90 min,3.3103990270947397
24227,David Smith,65,France,s8498,The Sapphires,"Comedies, Dramas, Independent Movies",99 min,2.776867678786683
18978,David Davis,14,Japan,s1680,Singham,"Action & Adventure, Dramas, International Movies",142 min,1.8874439682576245
19808,Jane Brown,42,Brazil,s3270,I'm with the Band: Nasty Cherry,Reality TV,1 Season,3.902385231590617
17605,Emma Johnson,59,India,s16,Dear White People,"TV Comedies, TV Dramas",4 Seasons,3.9646981168939304
12405,Jane Garcia,44,USA,s487,Ratchet and Clank,"Children & Family Movies, Comedies, Sci-Fi & Fantasy",94 min,4.0902735065685185
2774,David Williams,73,UK,s7603,NOVA: Chinese Chariot Revealed,Documentaries,54 min,1.2837049201732627
706,Jane Garcia,75,Japan,s4448,Katt Williams: The Pimp Chronicles: Pt. 1,Stand-Up Comedy,45 min,1.311368803559601
13254,Emma Brown,54,France,s1655,Before 30,"International TV Shows, Romantic TV Shows, TV Comedies",1 Season,3.511236081148187
13650,Michael Hernandez,52,UK,s2709,El Reemplazante,"International TV Shows, Spanish-Language TV Shows, TV Dramas",2 Seasons,3.6785953085238603
24858,Sarah Miller,17,Mexico,s2769,The Decline,"Action & Adventure, International Movies",83 min,4.365255070490431
16125,John Hernandez,74,Brazil,s7888,Rolling Papers,Documentaries,79 min,1.1225035627935358
6614,David Davis,47,India,s74,King of Boys,Nigeria,"Sharon Ooja\"",3.3811486028083184
2025,Chris Smith,63,Australia,s7632,Nymphomaniac: Volume II,"Dramas, Independent Movies, International Movies",124 min,2.9567430466372917
23678,James Hernandez,20,Brazil,s2239,Sunny Bunnies,"British TV Shows, Kids' TV, TV Comedies",2 Seasons,3.227409303250377
16132,Emma Johnson,25,Mexico,s567,Charlie's Angels,"Action & Adventure, Comedies",98 min,3.339542297343045
22164,Michael Martinez,47,India,s7686,Our Shining Days,"Comedies, Dramas, International Movies",103 min,3.1495745518173877
2446,James Brown,68,USA,s6399,Cabins in the Wild with Dick Strawbridge,"British TV Shows, International TV Shows, Reality TV",1 Season,2.3436502759020867
19714,David Jones,53,USA,s166,Oldsters,"Crime TV Shows, International TV Shows, Spanish-Language TV Shows",1 Season,1.6772742003103565
2757,Michael Brown,51,India,s998,Life in Color with David Attenborough,"British TV Shows, Docuseries, International TV Shows",1 Season,2.033512058853743
15925,Michael Johnson,15,Australia,s3852,Unchained Fate,"International TV Shows, TV Dramas, TV Sci-Fi & Fantasy",1 Season,0.6595538821283897
22208,Jane Hernandez,36,Mexico,s8698,War on Everyone,"Action & Adventure, Comedies",98 min,4.120203083482886
14770,Michael Martinez,20,UK,s4502,Wanderlust,"British TV Shows, International TV Shows, Romantic TV Shows",1 Season,0.19299129655065306
17021,Chris Brown,21,India,s3602,IZombie,"TV Comedies, TV Dramas, TV Horror",5 Seasons,4.786857555097434
9482,Emma Williams,57,UK,s3320,Hey Arnold! The Jungle Movie,"Children & Family Movies, Comedies",81 min,2.933789941144274
13031,Alex Johnson,32,Japan,s7931,San Pietro,"Classic Movies, Documentaries",32 min,0.07935947125944365
20244,Alex Johnson,31,Australia,s4238,Sam Kinison: Breaking the Rules,Stand-Up Comedy,50 min,2.5494261117397676
4256,Chris Johnson,28,Germany,s5400,Mystic Whispers,"International TV Shows, TV Dramas, TV Horror",1 Season,4.651299647625144
10058,Sarah Smith,68,Australia,s812,Super Monsters: Once Upon a Rhyme,Children & Family Movies,25 min,0.29948663986505974
15203,James Garcia,23,USA,s7926,Samantaral,"Dramas, International Movies",110 min,2.0453182728527435
24552,Sarah Brown,32,Brazil,s928,Barney and Friends,Kids' TV,2 Seasons,3.9211045270811455
9763,Katie Brown,69,USA,s6870,Goldstone,Thrillers,110 min,1.0856303648156351
17197,Emma Martinez,55,Brazil,s1123,Madam Chief Minister,"Dramas, International Movies",121 min,0.3084819191310878
12945,James Davis,25,Australia,s3163,It Comes at Night,"Horror Movies, Independent Movies",92 min,4.548489695186197
19144,Chris Garcia,31,Japan,s4084,Bert Kreischer: The Machine,Stand-Up Comedy,70 min,2.9095386639433323
1027,James Williams,67,Australia,s5436,Man to Man,"Crime TV Shows, International TV Shows, Korean TV Shows",1 Season,1.6438212461022217
23765,Chris Martinez,45,India,s2697,The Trial,"Crime TV Shows, International TV Shows, TV Dramas",1 Season,1.6442117322542056
6648,Chris Hernandez,55,Brazil,s389,Plastic Cup Boyz: Laughing My Mask Off!,"Stand-Up Comedy & Talk Shows, TV Comedies",1 Season,1.6971898996050228
17483,Alex Brown,70,India,s4652,Transformers Prime,Kids' TV,1 Season,0.539745804501473
22496,James Johnson,43,Brazil,s3094,The Vendor,"Comedies, International Movies",103 min,1.9317410721236423
22358,James Brown,78,Canada,s515,Cuckoo,"British TV Shows, International TV Shows, TV Comedies",5 Seasons,0.6853944709087828
10537,Sarah Jones,77,Japan,s4345,Oddbods: The Festive Menace,Movies,23 min,1.2417630040441545
24701,Alex Jones,55,India,s7200,Kill Command,"Action & Adventure, Independent Movies, Sci-Fi & Fantasy",100 min,2.766992491033265
23781,Jane Davis,33,Mexico,s785,Cloudburst,"Comedies, Dramas, Independent Movies",93 min,0.1521981369725145
7752,Chris Williams,42,Australia,s6060,A Tale of Love and Darkness,"Dramas, International Movies",98 min,2.359434253560492
20994,Chris Jones,48,Canada,s3923,Dabbe 5: Zehr-i Cin,"Horror Movies, International Movies",133 min,4.505229899690418
9248,Sarah Williams,70,Germany,s2348,Kappela,"Dramas, Independent Movies, International Movies",112 min,1.0405683879099032
8756,Sarah Hernandez,17,Canada,s7714,Patient Seventeen,Documentaries,68 min,4.233764008555346
23765,Chris Martinez,45,India,s3904,Someone Great,"Comedies, Romantic Movies",92 min,3.3411840868764413
24544,Sarah Martinez,13,Brazil,s6390,"Bure Kaam Bura Natija, Kyun Bhai Chacha Haan Bhatija",Kids' TV,1 Season,3.641058690122957
8804,Jane Hernandez,40,Germany,s3966,Santa Clarita Diet,"TV Comedies, TV Horror, TV Thrillers",3 Seasons,2.853088672103535
5856,Chris Smith,43,USA,s1538,Lee Daniels' The Butler,Dramas,132 min,0.7846611573138079
13592,Michael Williams,19,Australia,s715,Beyond Evil,"Crime TV Shows, International TV Shows, TV Thrillers",1 Season,4.693241130549183
3025,Emma Jones,62,Mexico,s4921,Dude,"Comedies, Dramas, Independent Movies",97 min,3.2529720050542545
9884,Jane Jones,75,Germany,s6398,Cabin Fever,"Horror Movies, Thrillers",98 min,1.8794979964924692
21327,Katie Brown,17,UK,s898,Use For My Talent,"International TV Shows, Romantic TV Shows, TV Comedies",1 Season,3.2055787153921402
21700,Jane Williams,22,UK,s846,A Place in the Stars,"Dramas, International Movies, Thrillers",110 min,0.8032350312416736
281,Michael Brown,16,UK,s8719,Westside vs. the World,"Documentaries, Sports Movies",96 min,2.857128309885768
10146,Chris Davis,32,UK,s4165,Goyo: The Boy General,"Dramas, International Movies",150 min,1.9861186817925298
7130,Alex Jones,31,Mexico,s8019,Silent Hill: Revelation,Horror Movies,94 min,1.4571904741883661
15455,Katie Smith,19,USA,s3490,Abstract: The Art of Design,Docuseries,2 Seasons,1.292086109754698
4311,Emma Williams,69,Germany,s7262,Lady Bloodfight,Action & Adventure,101 min,2.779758806284761
10761,Katie Garcia,79,India,s1755,Forged in Fire,Reality TV,1 Season,0.3751566918232113
3907,Michael Johnson,24,USA,s7161,Kaalia,"Action & Adventure, Dramas, International Movies",173 min,2.2531172756139277
7100,John Jones,56,Brazil,s7147,Jugaad,Documentaries,52 min,2.7653069126330996
6844,Alex Miller,18,USA,s8662,Unfinished Song,"Comedies, Dramas, Independent Movies",94 min,3.724125094992621
22540,John Miller,67,Mexico,s5871,Masha's Tales,Kids' TV,1 Season,0.8680265267045828
11484,Michael Williams,47,India,s6599,Deviant Love,Thrillers,87 min,2.7818433330342582
5638,Sarah Miller,16,Mexico,s3891,Njan Prakashan,"Comedies, Dramas, International Movies",125 min,0.10326280252653308
11882,David Davis,75,Mexico,s6003,2307: Winter's Dream,"Action & Adventure, Independent Movies, Sci-Fi & Fantasy",101 min,1.707791201564457
2392,Jane Miller,46,Brazil,s323,You're My Destiny,"International TV Shows, Romantic TV Shows, TV Comedies",1 Season,3.3389511278485817
21679,John Garcia,44,Germany,s7496,"Monster High: Frights, Camera, Action!",Children & Family Movies,74 min,0.043483843194259686
23767,James Hernandez,21,Canada,s1043,Garth Brooks: The Road I’m On,Docuseries,1 Season,3.528680695450176
20261,Chris Johnson,13,France,s8451,The Perfect Day,"Documentaries, International Movies, Sports Movies",93 min,3.5843867985909057
1670,Chris Hernandez,75,Australia,s686,Fatherhood,Dramas,111 min,2.523804407216625
11619,Michael Hernandez,25,Mexico,s204,Kyaa Kool Hain Hum 3,"Comedies, International Movies",124 min,0.2658915221892666
13606,Sarah Davis,78,Australia,s3080,ARASHI's Diary -Voyage-,"Docuseries, International TV Shows",1 Season,2.0656649243534417
18918,Sarah Williams,27,UK,s178,The Guns of Navarone,"Action & Adventure, Classic Movies",156 min,3.7401814471401362
20519,Emma Miller,23,Australia,s6949,Heal,Documentaries,107 min,1.7461110714742878
15159,Michael Garcia,50,Mexico,s5693,Lost & Found Music Studios,"Kids' TV, TV Comedies, TV Dramas",2 Seasons,1.499058165006525
22633,Emma Williams,79,UK,s4848,Sara's Notebook,"Dramas, International Movies, Thrillers",117 min,2.4359474867572137
16167,David Brown,29,France,s8167,Terminator 3: Rise of the Machines,"Action & Adventure, Sci-Fi & Fantasy",109 min,4.488060328947362
839,Chris Brown,57,France,s1994,Signs,"Crime TV Shows, International TV Shows, TV Dramas",2 Seasons,0.02392123333974594
6428,Chris Miller,34,Brazil,s7076,Inequality for All,Documentaries,90 min,0.6444857051456826
22662,Alex Brown,46,Australia,s4529,Seven in Heaven,Horror Movies,94 min,0.47802145352043246
20692,Jane Smith,64,USA,s2255,The Protector,"International TV Shows, Romantic TV Shows, TV Action & Adventure",4 Seasons,1.5314783467720434
2200,Jane Brown,45,Mexico,s6884,Goosebumps 2: Haunted Halloween,"Children & Family Movies, Comedies",90 min,3.850277829234102
11795,Alex Garcia,56,India,s5132,Shikari,"Dramas, International Movies, Music & Musicals",163 min,0.945563302925686
8685,John Johnson,50,USA,s5227,The Babysitter,"Comedies, Horror Movies",85 min,2.832688148063964
4347,John Brown,80,USA,s4481,Ronnie Coleman: The King,Documentaries,93 min,1.1155759368173712
21657,Katie Brown,17,USA,s5119,The Indian Detective,"Crime TV Shows, International TV Shows, TV Comedies",1 Season,0.8331610697235498
10498,Emma Brown,44,Canada,s8262,The Crying Game,"Classic Movies, Independent Movies, Thrillers",112 min,4.988031360926318
5743,John Johnson,33,USA,s5757,Justin Timberlake + the Tennessee Kids,Music & Musicals,90 min,0.6043250246498588
7508,Michael Hernandez,39,Australia,s7986,Set Up,Action & Adventure,85 min,1.8482697198541436
19359,Sarah Williams,77,UK,s8719,Westside vs. the World,"Documentaries, Sports Movies",96 min,1.1646501501517341
23851,Katie Miller,74,UK,s3079,Albert Pinto Ko Gussa Kyun Aata Hai?,"Dramas, Independent Movies, International Movies",85 min,1.0388164544632388
6479,Sarah Garcia,31,Japan,s7750,Planet Hulk,"Action & Adventure, Sci-Fi & Fantasy",81 min,1.2815020592530462
7388,John Jones,46,Australia,s8110,Strongland,"Docuseries, International TV Shows",1 Season,4.230368709684061
8821,Jane Smith,25,Japan,s4675,The Comedy Lineup,"Stand-Up Comedy & Talk Shows, TV Comedies",2 Seasons,0.09598918182886662
20181,John Johnson,27,Canada,s6152,An American Tail,Children & Family Movies,80 min,2.181701732574518
8887,Sarah Garcia,21,UK,s1227,The Houseboat,"Docuseries, International TV Shows",1 Season,2.5045924001460906
24005,Jane Martinez,41,India,s8193,The Ant's Scream,"Comedies, Dramas, International Movies",108 min,0.42320363118162785
8946,David Jones,29,Germany,s3642,The Son,"Dramas, Independent Movies, International Movies",93 min,0.47603012830763625
4469,Katie Williams,32,Mexico,s7345,Love Dot Com: The Social Experiment,"Comedies, Romantic Movies",98 min,1.6006630818569922
9487,Alex Garcia,60,Mexico,s6044,A Leaf of Faith,Documentaries,87 min,2.032004591791222
11234,Sarah Garcia,38,USA,s4020,Everything About Her,"Comedies, Dramas, International Movies",127 min,4.578959603362996
16556,Jane Jones,13,France,s598,Talladega Nights: The Ballad of Ricky Bobby,"Action & Adventure, Comedies, Sports Movies",108 min,1.4797061503844122
18849,Alex Hernandez,44,Australia,s2294,Cable Girls,"International TV Shows, Romantic TV Shows, Spanish-Language TV Shows",6 Seasons,3.9528623951140878
21261,Michael Miller,59,France,s2472,Uncut Gems,"Dramas, Thrillers",135 min,4.56121014015204
3073,Katie Johnson,54,USA,s132,Blade Runner: The Final Cut,"Action & Adventure, Classic Movies, Cult Movies",117 min,3.524578809389769
1170,Jane Miller,49,France,s1759,LEGO Ninjago,Kids' TV,2 Seasons,0.7442624767519973
16467,David Smith,73,Germany,s447,The Book of Henry,Dramas,105 min,2.8884457742244196
15027,James Garcia,52,Mexico,s8185,The Adventures of Tintin,Children & Family Movies,107 min,0.6372454115859594
11113,Chris Williams,36,Brazil,s2157,Tiny Creatures,"Docuseries, Science & Nature TV, TV Action & Adventure",1 Season,3.530314294124114
8854,John Davis,54,France,s4093,Kevin James: Sweat the Small Stuff,Stand-Up Comedy,42 min,0.8267701803742505
13019,Katie Garcia,21,Australia,s5155,The Many Faces of Ito,"International TV Shows, Romantic TV Shows, TV Dramas",1 Season,1.5976016279578165
13291,Jane Garcia,72,Japan,s4184,The World's Most Extraordinary Homes,"British TV Shows, Docuseries, International TV Shows",3 Seasons,1.3032267493310008
839,Chris Brown,57,France,s7161,Kaalia,"Action & Adventure, Dramas, International Movies",173 min,4.569859554505592
11763,Jane Smith,62,Canada,s1669,Heart & Soul,"International TV Shows, TV Dramas",1 Season,1.29621194025002
17773,Alex Johnson,74,Australia,s5928,Wyatt Cenac: Brooklyn,Stand-Up Comedy,68 min,2.733248349425288
15854,Sarah Williams,47,Germany,s1391,The Shadow of Violence,Dramas,101 min,4.403984715637144
13256,James Smith,39,Japan,s8369,The Irish Mob,"Crime TV Shows, Docuseries",1 Season,1.210897130405351
21862,Jane Williams,29,Canada,s6769,Flimflam,"Comedies, International Movies",102 min,1.932805456072073
21675,Chris Smith,21,India,s8393,The Liar,"Crime TV Shows, International TV Shows, TV Dramas",1 Season,4.889268513046757
13993,Katie Miller,74,India,s7536,My Entire High School Sinking Into the Sea,"Comedies, Independent Movies",77 min,2.1511768818903354
14261,John Jones,66,India,s6031,A Bridge Too Far,"Action & Adventure, Classic Movies, Dramas",176 min,1.4184988937613474
21884,Emma Jones,14,Australia,s6220,Bala Loca,"International TV Shows, Spanish-Language TV Shows, TV Dramas",1 Season,1.046890274920393
1270,Michael Williams,54,UK,s8126,Super Wings,"Kids' TV, Korean TV Shows",3 Seasons,2.881668333954017
4590,Katie Garcia,30,Australia,s4117,Velvet Colección,"International TV Shows, Romantic TV Shows, Spanish-Language TV Shows",2 Seasons,3.7514112215208946
21464,Jane Hernandez,48,Japan,s8612,Traffic Signal,"Dramas, Independent Movies, International Movies",130 min,0.7744036192785292
16462,Jane Williams,21,Japan,s3880,Ingress: The Animation,"Anime Series, Crime TV Shows, International TV Shows",1 Season,4.6625387199696915
21402,Katie Hernandez,29,USA,s1469,What Happened to Mr. Cha?,"Comedies, International Movies",102 min,1.6211375780118742
1437,David Davis,45,Mexico,s6703,Equals,"Dramas, Romantic Movies, Sci-Fi & Fantasy",102 min,1.4804475988226617
10006,James Garcia,26,India,s5886,W/ Bob & David,TV Comedies,1 Season,0.2303866428682816
12254,Alex Martinez,79,Brazil,s3257,Iliza Shlesinger: Unveiled,Stand-Up Comedy,78 min,1.6958531876303558
22702,Katie Johnson,23,UK,s1970,Road To High & Low,"Action & Adventure, International Movies",94 min,0.6583361811641347
13769,James Miller,35,Germany,s4622,Made in Mexico,"International TV Shows, Reality TV, Spanish-Language TV Shows",1 Season,3.9345109166516656
6816,John Hernandez,54,Germany,s5800,Chef's Table: France,Docuseries,1 Season,2.5754205344037704
2188,Sarah Martinez,19,USA,s1616,Ink Master,Reality TV,2 Seasons,1.9407145857553036
8276,Katie Hernandez,36,Germany,s3444,Love for Sale,"Dramas, International Movies, Romantic Movies",101 min,1.2609999469461823
12322,Chris Smith,48,France,s3541,Moving Art,"Docuseries, Science & Nature TV",3 Seasons,2.1644112427657722
20109,Sarah Martinez,56,Japan,s6345,Blue Valentine,"Dramas, Independent Movies, Romantic Movies",112 min,4.115479111449159
22383,David Jones,16,Germany,s377,Transformers: War for Cybertron: Kingdom,Anime Series,1 Season,4.505290232143663
12984,Jane Garcia,67,France,s4481,Ronnie Coleman: The King,Documentaries,93 min,4.601544418930755
16787,James Jones,13,Germany,s1049,Power Players,Kids' TV,3 Seasons,2.374252001798192
20838,Emma Williams,59,Germany,s4769,Camarón: The Film,"Documentaries, International Movies, Music & Musicals",105 min,3.4305298886927265
1564,Chris Smith,69,France,s1347,All My Friends Are Dead,"Comedies, Dramas, International Movies",97 min,2.7897834387676292
21573,Chris Williams,59,Germany,s2539,Wedy Atkalam,"Comedies, Dramas, International Movies",72 min,4.720636395228849
4762,Chris Garcia,39,Germany,s2198,Shine Your Eyes,"Dramas, Independent Movies, International Movies",103 min,0.06794518211328315
11902,Sarah Johnson,36,France,s3142,Karthik Calling Karthik,"Dramas, International Movies, Thrillers",135 min,1.8709665604279175
23119,David Brown,43,Germany,s8306,The Flintstones in Viva Rock Vegas,"Children & Family Movies, Comedies, Romantic Movies",91 min,4.236435598486501
18828,Sarah Miller,24,USA,s2650,This Earth of Mankind,"Dramas, International Movies",180 min,3.785189656558407
2324,Katie Brown,72,Mexico,s1578,Emicida: AmarElo - It’s All For Yesterday,"Documentaries, International Movies, Music & Musicals",90 min,2.09937054321311
24484,Emma Miller,30,Germany,s8156,Teach Us All,Documentaries,81 min,0.6912184273484212
4089,Chris Miller,21,UK,s8354,The Hunt,"British TV Shows, Docuseries, Science & Nature TV",1 Season,3.066094051302168
10844,Katie Hernandez,41,Japan,s5648,Autohead,"Dramas, International Movies, Thrillers",97 min,4.965999698710862
16608,Emma Hernandez,72,Brazil,s4003,Bombairiya,"Comedies, Dramas, International Movies",108 min,3.4264966976326927
21386,David Johnson,43,France,s1504,Lovestruck in the City,"International TV Shows, Romantic TV Shows, TV Comedies",1 Season,2.9845491952336953
10088,Jane Martinez,22,Canada,s4972,Layla M.,"Dramas, International Movies",99 min,3.371577747081851
21501,Sarah Brown,35,Germany,s531,Richie Rich,"Kids' TV, TV Comedies",2 Seasons,3.7455881568219302
2223,David Smith,51,Brazil,s5318,Berlin Syndrome,"International Movies, Thrillers",116 min,0.6590582462195416
15685,Emma Smith,19,Australia,s5402,Spice Up,"International TV Shows, Romantic TV Shows, TV Dramas",1 Season,3.6751146669416954
9963,Jane Garcia,18,Brazil,s4407,The Queen of Flow,"Crime TV Shows, International TV Shows, Spanish-Language TV Shows",1 Season,2.734012494875579
11039,Emma Smith,30,UK,s1007,Motu Patlu Dino Invasion,"Children & Family Movies, Comedies",80 min,4.889618419203251
9120,Alex Brown,52,Mexico,s1658,Notes for My Son,"Dramas, International Movies",84 min,1.579979774591103
5020,James Davis,78,Mexico,s7876,Road to Yesterday,"Dramas, International Movies",96 min,4.127327655375493
4267,Emma Davis,56,USA,s1850,Kartini: Princess of Java,"Dramas, International Movies",118 min,0.24143677366703808
8088,Jane Davis,61,USA,s8306,The Flintstones in Viva Rock Vegas,"Children & Family Movies, Comedies, Romantic Movies",91 min,0.23021332268945427
19610,Jane Miller,80,UK,s1928,Baxu and the Giants,"Dramas, International Movies",29 min,4.880636416862954
2020,Emma Williams,24,UK,s3969,The Terminal,"International TV Shows, TV Dramas",1 Season,4.4949266033830435
14371,John Miller,46,France,s3265,Earthquake Bird,"Dramas, Romantic Movies",107 min,3.169727733181243
18069,Michael Martinez,36,Canada,s7415,Marvel & ESPN Films Present: 1 of 1: Genesis,"Documentaries, Sports Movies",77 min,1.5012471935721794
9970,Chris Williams,80,Australia,s3482,Bard of Blood,"International TV Shows, TV Action & Adventure, TV Dramas",1 Season,1.5624166694590773
8469,Sarah Hernandez,18,Australia,s8310,The Foreigner,"Action & Adventure, International Movies",113 min,1.5358924393630087
15987,Jane Davis,41,Brazil,s5815,Real Crime: Supermarket Heist (Tesco Bomber),Documentaries,46 min,3.9187183409149187
6365,Alex Johnson,26,UK,s3927,The Perfect Date,"Comedies, Romantic Movies",91 min,1.5276146718268007
16632,Katie Jones,27,UK,s1523,Talentime,"Dramas, International Movies, Romantic Movies",120 min,1.0016776387263404
22820,Michael Jones,56,Brazil,s8733,White Chamber,"Sci-Fi & Fantasy, Thrillers",89 min,3.303166963193778
