6121,Emma Williams,75,India,s8735,Who the F**k Is That Guy?,"Documentaries, LGBTQ Movies, Music & Musicals",78 min,1.1825763080420288
17857,James Johnson,62,Germany,s3262,Suffragette,"Dramas, International Movies",107 min,1.9476313005381973
9339,Michael Williams,73,USA,s1922,The Outpost,"Action & Adventure, Dramas",123 min,2.1359426874285847
20334,Alex Smith,75,Japan,s8144,Sym-Bionic Titan,Kids' TV,1 Season,2.2812007790987354
18316,Katie Brown,57,Japan,s7581,Newtown,Documentaries,84 min,4.849948562142112
14821,Emma Hernandez,51,UK,s178,The Guns of Navarone,"Action & Adventure, Classic Movies",156 min,4.231503001820974
18215,Sarah Williams,38,India,s8788,You Can’t Fight Christmas,"Comedies, Romantic Movies",85 min,0.33319786228845627
7065,Chris Johnson,78,Mexico,s7754,Playing Hard,"Documentaries, International Movies",92 min,4.778027383169644
7916,John Davis,62,UK,s1874,The Haunting of Bly Manor,"TV Dramas, TV Horror, TV Mysteries",1 Season,1.4271363641182755
13448,David Jones,51,India,s4998,Borderliner,"Crime TV Shows, International TV Shows, TV Dramas",1 Season,2.196716428570155
8374,Emma Johnson,14,Canada,s1642,Sugar Rush Christmas,Reality TV,2 Seasons,2.7257753699614966
23925,Chris Smith,78,Canada,s5545,Deuces,Dramas,88 min,0.222516032149363
24797,Emma Martinez,15,Japan,s7194,Kicking and Screaming,"Comedies, Independent Movies, Romantic Movies",97 min,4.25663558572659
15595,Chris Williams,34,France,s6493,Clash of the Titans,"Action & Adventure, Sci-Fi & Fantasy",106 min,0.10051362876779879
7195,Katie Jones,52,USA,s7167,Kaleidoscope,Thrillers,99 min,4.855894636089262
16054,David Williams,50,Japan,s464,A Classic Horror Story,"Horror Movies, International Movies",95 min,3.174759095026376
10943,Michael Brown,65,Australia,s5247,Sudden,"International TV Shows, Romantic TV Shows, TV Dramas",1 Season,2.7723028633882323
13782,Emma Williams,66,Mexico,s4465,Welcome to Sajjanpur,"Comedies, Dramas, International Movies",131 min,2.5855839700012684
21382,Chris Miller,37,Canada,s4122,Kevin Hart's Guide to Black History,"Children & Family Movies, Comedies",63 min,2.774896939990757
24062,Chris Williams,29,Australia,s4198,Baazaar,"Dramas, International Movies",136 min,0.97854651203719
19011,Jane Miller,17,Canada,s4955,Om Shanti Om,"Comedies, Dramas, International Movies",169 min,0.6925461757274942
18374,David Brown,29,UK,s1466,The Haunted Hathaways,"Kids' TV, TV Comedies, TV Sci-Fi & Fantasy",2 Seasons,4.935928456955832
121,Sarah Williams,44,Canada,s657,Love Is a Story,"International Movies, Music & Musicals, Romantic Movies",105 min,2.8255002256581814
7087,Michael Smith,70,Australia,s4876,Anon,"Dramas, Sci-Fi & Fantasy, Thrillers",100 min,2.4135865390717863
14504,Emma Martinez,69,Brazil,s3854,I Have a Script,"International TV Shows, TV Comedies, TV Dramas",1 Season,0.4098062917583789
17068,James Jones,45,India,s949,Swiped,Comedies,94 min,2.0561908234101747
24798,Alex Davis,51,France,s7395,Mandobasar Galpo,"Dramas, International Movies, Romantic Movies",103 min,0.6387097705019629
20136,Sarah Garcia,26,UK,s6309,Bigger Fatter Liar,"Children & Family Movies, Comedies",95 min,1.8294558845908266
16005,Alex Davis,77,Germany,s2226,Gigantosaurus,Kids' TV,1 Season,4.5450296764362434
7583,Chris Davis,72,Canada,s5294,Berserk: The Golden Age Arc III - The Advent,"Action & Adventure, Anime Features, International Movies",107 min,2.7136088145439308
22022,Jane Miller,40,Mexico,s1278,Two Sentence Horror Stories,"TV Horror, Teen TV Shows",2 Seasons,3.8936290729298584
17761,Katie Martinez,53,Germany,s786,Cocomelon,Kids' TV,3 Seasons,4.713938186579394
24832,Michael Smith,61,France,s511,Between,"International TV Shows, TV Dramas, TV Mysteries",2 Seasons,1.853653916023192
16171,Alex Martinez,54,UK,s1866,Phir Hera Pheri,"Comedies, International Movies",150 min,2.3081417626492358
12173,Katie Hernandez,62,Brazil,s7909,Russell Peters vs. the World,"Docuseries, Stand-Up Comedy & Talk Shows",1 Season,1.673588744986398
7050,Alex Garcia,26,Australia,s16,Dear White People,"TV Comedies, TV Dramas",4 Seasons,4.198629830410034
4884,Alex Jones,70,Germany,s7642,Off Course,"Comedies, International Movies",107 min,2.4095713346633736
17163,Katie Garcia,50,Canada,s4289,Ashes of Love,"International TV Shows, Romantic TV Shows, TV Comedies",1 Season,3.2972183828044606
23509,David Hernandez,24,Mexico,s457,Her Private Life,"International TV Shows, Romantic TV Shows, TV Comedies",1 Season,4.619971540704341
12836,Jane Davis,76,Germany,s3010,A Fall from Grace,"Dramas, Thrillers",121 min,3.0146598525547645
16996,James Davis,16,Mexico,s7464,Miss Dynamite,"Crime TV Shows, International TV Shows, Spanish-Language TV Shows",1 Season,4.112853800149124
24180,Alex Smith,43,Brazil,s3388,Master Z: The Ip Man Legacy,"Action & Adventure, International Movies",108 min,3.181327726284935
19080,Sarah Garcia,36,Mexico,s8141,Swiss Army Man,"Comedies, Dramas, Independent Movies",97 min,2.547755852903703
4200,Emma Hernandez,15,Australia,s2185,Get Even,"British TV Shows, Crime TV Shows, International TV Shows",1 Season,0.8184208474755106
22614,Emma Garcia,58,Mexico,s641,Jiva!,"International TV Shows, TV Dramas",1 Season,1.919868689145709
19653,Alex Davis,72,Canada,s5541,Win It All,"Comedies, Independent Movies, Romantic Movies",89 min,4.174190701736626
12914,Michael Johnson,69,France,s6368,Boy Bye,"Comedies, Romantic Movies",86 min,1.96843047712435
22250,Sarah Brown,24,Germany,s674,No Time for Shame,"International TV Shows, Reality TV, Spanish-Language TV Shows",1 Season,3.929592029097141
11525,Jane Martinez,25,USA,s6220,Bala Loca,"International TV Shows, Spanish-Language TV Shows, TV Dramas",1 Season,0.6164370781797385
13883,Chris Williams,14,Japan,s5656,Chasing Cameron,"Reality TV, Teen TV Shows",1 Season,4.069784321351285
13571,Chris Martinez,45,Japan,s2126,Takki,"International TV Shows, TV Dramas",2 Seasons,2.8542898281939544
2755,John Garcia,60,Japan,s7320,Little Singham in London,"Children & Family Movies, Comedies",66 min,4.327718174038814
609,Alex Davis,19,Japan,s4653,Transformers: Robots in Disguise,Kids' TV,1 Season,0.7674692340983763
22347,Alex Hernandez,80,France,s2841,Angu Vaikuntapurathu (Malayalam),"Action & Adventure, Comedies, Dramas",162 min,2.435673269884782
6739,Michael Johnson,48,USA,s8457,The Pirates of Somalia,Dramas,118 min,3.4861164850501387
10894,Michael Miller,55,France,s8404,The Look of Silence,"Documentaries, International Movies",103 min,3.6407123905564758
22541,Jane Garcia,15,Germany,s4308,The Fix,TV Comedies,1 Season,1.582568795325758
24209,Jane Miller,62,Australia,s327,Beethoven's 2nd,"Children & Family Movies, Comedies",88 min,0.46256275134168134
10176,Chris Williams,59,Japan,s2089,Unknown Origins,"International Movies, Thrillers",97 min,3.451180273390807
3519,Sarah Johnson,40,USA,s2402,The Woods,"Crime TV Shows, International TV Shows, TV Dramas",1 Season,1.9988186257971807
19312,Alex Williams,36,India,s1269,El final del paraíso,"Crime TV Shows, International TV Shows, Spanish-Language TV Shows",1 Season,4.089919168544008
7567,Jane Garcia,38,UK,s7137,John Carter,"Action & Adventure, Sci-Fi & Fantasy",133 min,4.758118477435843
18449,Michael Smith,72,Germany,s3096,The Bonfire of Destiny,"International TV Shows, TV Dramas",1 Season,0.6734101197241554
1358,Sarah Miller,61,Mexico,s7065,Incomplete,"Dramas, International Movies, Romantic Movies",119 min,4.347520068515448
19196,James Hernandez,26,Canada,s2397,Frank Elstner: Just One Last Question,"International TV Shows, Stand-Up Comedy & Talk Shows",1 Season,3.0087758556295396
11344,Emma Johnson,57,USA,s4194,Sebastian Maniscalco: Stay Hungry,Stand-Up Comedy,65 min,2.813977044687289
10365,David Martinez,51,Australia,s2981,What the Love! with Karan Johar,"International TV Shows, Reality TV, Romantic TV Shows",1 Season,2.251555944113441
7403,Alex Brown,40,USA,s1857,BLACKPINK: Light Up the Sky,"Documentaries, Music & Musicals",80 min,2.128826304855733
14131,Alex Johnson,14,India,s5517,Shepherds and Butchers,"Dramas, International Movies",106 min,0.6004526655235592
8036,Jane Smith,68,Japan,s1362,The Unsettling,"TV Horror, Teen TV Shows",1 Season,2.9481939741263066
22772,David Johnson,30,UK,s5569,Pandora,"Dramas, International Movies, Thrillers",137 min,3.9073067723466712
3557,John Johnson,33,Brazil,s8518,The Stanford Prison Experiment,"Dramas, Independent Movies, Thrillers",122 min,3.999420088339412
502,Alex Davis,19,USA,s3731,The Wolf's Call,"Dramas, International Movies, Thrillers",116 min,3.219059371494958
19139,Sarah Hernandez,78,Canada,s5674,K-POP Extreme Survival,"International TV Shows, Korean TV Shows, Romantic TV Shows",1 Season,4.128811117428127
17409,James Hernandez,59,France,s6460,Chewin' the Fat,"British TV Shows, TV Comedies",1 Season,4.128898098176127
4143,John Martinez,24,UK,s1541,Nocturnal Animals,"Dramas, Thrillers",117 min,4.34023363370659
12349,Alex Smith,20,Japan,s8110,Strongland,"Docuseries, International TV Shows",1 Season,4.890248728604221
11701,James Smith,69,Canada,s7084,Inst@famous,Reality TV,1 Season,3.4069573975622056
10464,Michael Martinez,78,Canada,s3501,Between Two Ferns: The Movie,Comedies,83 min,3.768146119819646
17755,Chris Smith,36,Canada,s1972,Bhaji In Problem,"Comedies, International Movies",117 min,4.942830528303961
17937,Emma Smith,45,Mexico,s1516,Guest House,Comedies,84 min,1.745071766608578
2775,Michael Miller,67,India,s179,The Interview,"Action & Adventure, Comedies",112 min,4.595157457039709
14646,John Smith,70,Brazil,s4487,How to Get Over a Breakup,"Comedies, International Movies, Romantic Movies",104 min,1.9014796772525289
13073,David Jones,75,UK,s7653,On Yoga The Architecture of Peace,"Documentaries, Faith & Spirituality",92 min,1.5997869401067788
11411,Chris Brown,37,India,s2411,The Witch: Part 1 - The Subversion,"Action & Adventure, International Movies, Sci-Fi & Fantasy",126 min,4.688470235377513
17374,Sarah Brown,66,USA,s2641,After Life,"British TV Shows, International TV Shows, TV Comedies",2 Seasons,2.477667378503126
2399,Emma Brown,43,UK,s5213,Wedding Unplanned,"Comedies, International Movies, Romantic Movies",94 min,4.235876551402981
3091,Alex Garcia,35,Australia,s773,Summertime,"International TV Shows, Romantic TV Shows, TV Dramas",2 Seasons,3.781904224231969
5537,Michael Miller,33,France,s8600,Toast of London,"British TV Shows, Classic & Cult TV, TV Comedies",3 Seasons,1.0897183048153347
17577,Katie Martinez,65,Australia,s6260,Beak & Brain: Genius Birds From Down Under,"Documentaries, International Movies",52 min,3.696402125208258
10008,John Smith,77,Japan,s8503,The Seven Five,Documentaries,104 min,0.4101948354624996
21329,Sarah Brown,27,Japan,s8581,Thor: Ragnarok,"Action & Adventure, Comedies, Sci-Fi & Fantasy",131 min,3.344845075825919
23113,Katie Garcia,65,India,s6292,Beyblade: Metal Fusion,"Anime Series, Kids' TV",1 Season,2.556662721442602
21570,James Miller,52,France,s567,Charlie's Angels,"Action & Adventure, Comedies",98 min,1.903823865933173
577,Michael Miller,73,Australia,s292,SHAMAN KING,"Anime Series, International TV Shows",1 Season,2.3972802166553815
10481,John Miller,18,Australia,s1845,A Babysitter's Guide to Monster Hunting,Children & Family Movies,99 min,0.44392329085023274
13907,Katie Jones,36,Canada,s3564,Kaake Da Viyah,"Comedies, Dramas, International Movies",133 min,4.791975703604195
10889,James Davis,42,Canada,s8064,Sparkle,"Dramas, Music & Musicals",98 min,1.0356845612084553
6935,Chris Hernandez,33,USA,s657,Love Is a Story,"International Movies, Music & Musicals, Romantic Movies",105 min,1.6753980639473043
20310,Jane Williams,59,France,s2084,The Debt Collector 2,Action & Adventure,97 min,4.8038413361268875
24253,Katie Miller,66,USA,s3945,Tijuana,"Crime TV Shows, International TV Shows, Spanish-Language TV Shows",1 Season,0.032586156210925865
10861,Alex Johnson,73,UK,s2639,الف مبروك,"Comedies, Dramas, International Movies",115 min,3.3044443171120568
6944,Katie Williams,22,Japan,s1873,The Forty-Year-Old Version,"Comedies, Dramas, Independent Movies",124 min,0.20377663152330527
316,Jane Miller,17,France,s6799,Free Willy,"Children & Family Movies, Dramas",112 min,0.9301431045177466
21348,Chris Davis,78,France,s5307,Offline - Das leben ist kein bonuslevel,"Action & Adventure, Comedies, International Movies",89 min,1.9348110596751371
14692,John Davis,52,UK,s6227,Band of Robbers,"Action & Adventure, Comedies, Independent Movies",95 min,4.357349794738882
13371,John Brown,75,UK,s332,Darwin’s Game,"Anime Series, International TV Shows, TV Thrillers",1 Season,0.8970009612451874
15640,David Hernandez,39,Germany,s1884,StarBeam: Halloween Hero,Children & Family Movies,33 min,4.711505703596705
18795,Sarah Davis,45,Mexico,s2371,El límite infinito,"Documentaries, International Movies, Sports Movies",48 min,1.7514123011580223
21313,Alex Jones,53,Canada,s4716,Flavors of Youth: International Version,"Anime Features, International Movies, Romantic Movies",74 min,1.8195193387621744
564,Sarah Johnson,35,Australia,s4440,Grandmaster,"International Movies, Thrillers",133 min,1.8704783368221367
22934,Michael Hernandez,65,Canada,s5573,"Bon Cop, Bad Cop","Action & Adventure, Comedies, International Movies",117 min,0.5905224849735691
1178,Jane Smith,30,Germany,s5666,Color of Woman,"International TV Shows, Korean TV Shows, Romantic TV Shows",1 Season,0.7628038968543677
20384,Jane Johnson,23,Germany,s4097,Studio 54,Documentaries,99 min,2.5154284012019485
11394,Sarah Jones,38,Japan,s5742,Trailer Park Boys: Out of the Park: Europe,"International TV Shows, TV Comedies",1 Season,1.8638818414027813
7773,James Garcia,71,Mexico,s549,Grey's Anatomy,"Romantic TV Shows, TV Dramas",17 Seasons,0.576546063754711
21422,Katie Jones,62,India,s137,Cold Mountain,"Dramas, Romantic Movies",154 min,1.4495471510401226
17776,David Miller,18,Mexico,s4227,The Paper,"International TV Shows, TV Dramas",2 Seasons,4.726813862061251
10172,Sarah Jones,20,Germany,s8735,Who the F**k Is That Guy?,"Documentaries, LGBTQ Movies, Music & Musicals",78 min,3.6403772035922684
9778,John Smith,34,Mexico,s4851,Ibiza,"Comedies, Romantic Movies",94 min,0.045073087378855736
11574,Emma Williams,13,India,s3259,Candy Online,"International TV Shows, TV Dramas, Teen TV Shows",1 Season,2.093615393998538
7705,Sarah Johnson,51,UK,s8295,The Fear of 13,"Documentaries, International Movies",95 min,2.0041347674051257
20874,Jane Williams,49,UK,s7892,Room on the Broom,"Children & Family Movies, Independent Movies",26 min,2.3779030850007405
23226,Jane Jones,52,Japan,s5975,แผนร้ายนายเจ้าเล่ห์,"International TV Shows, Romantic TV Shows, TV Comedies",1 Season,4.0939489516365395
19070,Katie Smith,52,Mexico,s5454,Little Boxes,"Comedies, Dramas, Independent Movies",89 min,2.203716983742626
15365,John Martinez,20,UK,s4420,They’ll Love Me When I’m Dead,Documentaries,98 min,2.13208854870288
10591,David Jones,20,France,s3541,Moving Art,"Docuseries, Science & Nature TV",3 Seasons,3.1942990686004356
22100,Jane Davis,43,Australia,s3660,Pinky Malinky,"Kids' TV, TV Comedies",3 Seasons,0.03824461513401545
20992,Michael Hernandez,60,Australia,s6657,E-Cigarettes: Miracle or Menace?,Documentaries,52 min,3.4770142996296287
16179,Katie Jones,36,France,s350,Seabiscuit,"Dramas, Sports Movies",141 min,0.31323282981612743
5769,Katie Jones,19,Brazil,s7788,Power Rangers: Megaforce: Raising Spirits,Children & Family Movies,24 min,4.718026918418169
20412,Jane Jones,17,Canada,s845,Nail Bomber: Manhunt,"Documentaries, International Movies",73 min,3.4664662493323366
16433,Alex Martinez,35,France,s4050,Sarkar,"Action & Adventure, Dramas, International Movies",162 min,2.834341646828072
12796,James Jones,26,UK,s7124,Jeopardy!,Reality TV,2 Seasons,0.5959983136642361
21092,Chris Jones,29,Australia,s3259,Candy Online,"International TV Shows, TV Dramas, Teen TV Shows",1 Season,0.6181041665170739
5165,Alex Davis,18,UK,s8699,Warda,"Horror Movies, Independent Movies, International Movies",73 min,4.538386631893266
4361,Katie Hernandez,78,France,s5621,The Reconquest,"Dramas, International Movies, Romantic Movies",108 min,1.7808308295932536
2259,David Smith,67,Canada,s8359,The Incident,"International Movies, Sci-Fi & Fantasy, Thrillers",100 min,2.3547608887003593
4217,John Miller,70,India,s2985,Omniscient,"International TV Shows, TV Dramas, TV Sci-Fi & Fantasy",1 Season,3.499876042287654
658,Alex Garcia,73,Brazil,s2157,Tiny Creatures,"Docuseries, Science & Nature TV, TV Action & Adventure",1 Season,2.453158473676294
10607,James Brown,32,Australia,s5288,The Vampire Diaries,"TV Dramas, TV Mysteries, TV Sci-Fi & Fantasy",8 Seasons,0.1595480671659799
21877,Jane Smith,42,Germany,s4653,Transformers: Robots in Disguise,Kids' TV,1 Season,4.595523474996823
7502,Chris Miller,47,Mexico,s1457,Into the Wild,"Action & Adventure, Dramas, Independent Movies",148 min,4.445141168712717
15924,Chris Williams,24,Germany,s7496,"Monster High: Frights, Camera, Action!",Children & Family Movies,74 min,4.288465716063076
3607,Jane Garcia,55,USA,s4460,Sigaram Thodu,"Dramas, International Movies, Thrillers",141 min,0.6556262531576351
5759,Michael Garcia,44,UK,s8294,The Fear,"British TV Shows, Crime TV Shows, TV Dramas",1 Season,0.5493694413258898
3865,John Williams,69,Australia,s7585,Night Moves,"Dramas, Independent Movies, Thrillers",113 min,1.4363305457691367
11938,Emma Williams,45,France,s243,Comedy Premium League,"International TV Shows, TV Comedies",1 Season,3.4552183867359143
13999,James Garcia,72,Mexico,s2887,Pete Davidson: Alive From New York,Stand-Up Comedy,50 min,2.351281096360385
706,Jane Garcia,75,Japan,s2063,Blue Exorcist,"Anime Series, International TV Shows",2 Seasons,0.0023619340004094047
2188,Sarah Martinez,19,USA,s6393,Burning,"Dramas, Independent Movies, International Movies",148 min,2.025253827261218
1624,Sarah Johnson,47,Japan,s1323,Growing up and other problems,"Comedies, Dramas, International Movies",91 min,1.8703946062074355
10935,Sarah Martinez,40,Canada,s5328,Million Yen Women,"Crime TV Shows, International TV Shows, TV Dramas",1 Season,1.0962916882292606
2412,Jane Jones,20,Germany,s1762,Little Monsters,"Children & Family Movies, Comedies",102 min,2.5879886054734715
258,Jane Johnson,31,Germany,s1835,Start-Up,"International TV Shows, Romantic TV Shows, TV Comedies",1 Season,3.491704849374398
3584,Chris Johnson,59,UK,s3424,Black Money Love,"Crime TV Shows, International TV Shows, TV Dramas",1 Season,3.2244202805651314
1901,David Brown,29,France,s5556,Hoff the Record,"British TV Shows, TV Comedies",2 Seasons,0.0321474229802049
18595,Katie Garcia,37,Australia,s7798,Professor Mack,"Comedies, Romantic Movies",84 min,0.5043482478260936
20657,Alex Smith,50,Brazil,s4487,How to Get Over a Breakup,"Comedies, International Movies, Romantic Movies",104 min,0.16717825896584493
2487,Alex Miller,15,Canada,s2186,Latte and the Magic Waterstone,"Children & Family Movies, Comedies",83 min,2.0099648468329216
15468,James Hernandez,13,UK,s1384,Blown Away,"International TV Shows, Reality TV",2 Seasons,3.190328014170374
16205,Emma Garcia,69,India,s3612,Misaeng,"International TV Shows, Korean TV Shows, TV Dramas",1 Season,1.1804122719864978
3595,Katie Davis,22,Australia,s3317,Bella and the Bulldogs,"Kids' TV, TV Comedies",1 Season,2.758091706275279
11227,Alex Miller,22,Canada,s4573,Jatt James Bond,"Comedies, Dramas, International Movies",142 min,2.0080907000658983
14092,James Smith,27,Mexico,s1077,Shiva VS Autobots,Children & Family Movies,80 min,2.0554956345813515
14117,Chris Martinez,55,Australia,s3239,Dolly Parton's Heartstrings,TV Dramas,1 Season,0.0929195702290131
11001,Alex Smith,67,India,s4456,Paan Singh Tomar,"Action & Adventure, Dramas, International Movies",129 min,1.541603222239305
356,Sarah Garcia,72,France,s4932,Pickpockets,"Dramas, Independent Movies, International Movies",108 min,0.8680849877691987
22282,Emma Williams,29,Brazil,s5955,Even the Rain,"Dramas, International Movies",103 min,1.5054740017583768
18521,Chris Brown,16,Germany,s3789,Chopsticks,"Comedies, Dramas, Independent Movies",101 min,4.400665077114207
2266,David Garcia,25,Germany,s7472,Mission Control: The Unsung Heroes of Apollo,Documentaries,100 min,2.9897338614834372
5504,Emma Brown,78,Australia,s1862,Dil,"Comedies, Dramas, International Movies",165 min,0.8330842694804558
19696,Sarah Jones,30,France,s1666,40 Sticks,"International Movies, Thrillers",93 min,0.9596355957132724
1564,Chris Smith,69,France,s3246,Singapore Social,"International TV Shows, Reality TV",1 Season,3.6317923037987305
14697,John Brown,14,Brazil,s5227,The Babysitter,"Comedies, Horror Movies",85 min,0.8847147838516223
12186,John Hernandez,30,Japan,s4892,My Perfect Romance,"Comedies, International Movies, Romantic Movies",92 min,1.8187929321012049
11888,James Miller,76,India,s3666,God Eater,"Anime Series, International TV Shows",1 Season,4.207326804311215
7189,Alex Miller,57,USA,s7132,JingleKids,Kids' TV,1 Season,1.0112897469210558
22902,Michael Davis,41,UK,s4106,Larry Charles' Dangerous World of Comedy,"Docuseries, TV Comedies",1 Season,3.591710273416686
1262,Alex Martinez,58,Japan,s1937,Welcome to Sudden Death,Action & Adventure,80 min,2.6586185292591984
8853,Jane Johnson,45,Japan,s934,Hachi: A Dog's Tale,"Children & Family Movies, Dramas",93 min,3.6074411512638487
24348,Alex Hernandez,28,Germany,s4162,Surga Yang Tak Dirindukan 2,"Dramas, Faith & Spirituality, International Movies",119 min,0.9247680729339325
5603,Katie Davis,61,Canada,s643,The Naked Director,"International TV Shows, TV Dramas",2 Seasons,1.333962722379779
18190,David Williams,59,Germany,s3517,Oh! Baby,"Comedies, International Movies, Music & Musicals",157 min,1.7650544280486835
18269,Katie Brown,29,Australia,s143,Freedom Writers,Dramas,124 min,0.4661125023204532
13179,Sarah Hernandez,62,India,s5077,Arango y Sanint: Ríase el show,Stand-Up Comedy,62 min,0.09882070261809095
10630,James Smith,34,Canada,s7187,Khosla Ka Ghosla,"Comedies, Dramas, International Movies",124 min,2.65879304043993
7890,Katie Brown,21,Japan,s3667,GRANBLUE FANTASY the Animation,"Anime Series, International TV Shows",1 Season,4.124693204229064
24268,Katie Martinez,80,Germany,s830,Dog Gone Trouble,"Children & Family Movies, Comedies",88 min,0.0997236125493195
5679,Sarah Martinez,14,Japan,s1147,Haunted: Latin America,"International TV Shows, Reality TV, Spanish-Language TV Shows",1 Season,4.276142289309498
14425,James Davis,38,France,s8502,The Secret Life of Pets 2,"Children & Family Movies, Comedies",86 min,3.293955410900742
22871,Katie Martinez,20,France,s874,Ahaan,"Dramas, Independent Movies, International Movies",81 min,1.795952398516199
15806,Michael Martinez,68,Japan,s5991,14 Blades,"Action & Adventure, International Movies",113 min,4.036697949414345
2919,Sarah Brown,28,Brazil,s1115,3 Idiots,"Comedies, Dramas, International Movies",164 min,2.9931328751079707
1258,Chris Martinez,25,UK,s3085,Rainbow Ruby,Kids' TV,1 Season,4.12662522723312
1722,Michael Martinez,57,Brazil,s7944,Satrangi Re,"Dramas, International Movies, Music & Musicals",150 min,3.277463773227438
396,David Smith,58,Brazil,s4393,May the Devil Take You,"Horror Movies, International Movies",111 min,3.710718811571545
2296,Katie Hernandez,46,India,s2192,Retablo,"Dramas, International Movies",102 min,4.507406341227506
7073,Emma Hernandez,31,Germany,s7761,Power Battle Watch Car,"Kids' TV, Korean TV Shows",1 Season,2.8220812887195663
18129,Chris Martinez,52,India,s2854,Fat Ballerina - David A. Arnold,Stand-Up Comedy,61 min,1.2789662291777608
11132,Chris Hernandez,32,Canada,s6721,Exit Afghanistan,"Documentaries, International Movies",58 min,0.4786578705138922
16234,Sarah Garcia,14,UK,s5529,Bibi & Tina: Girls Versus Boys,"Children & Family Movies, Music & Musicals",107 min,4.404921363757451
4982,David Smith,25,Brazil,s3491,Birders,"Documentaries, International Movies",38 min,0.6178621864277706
15059,James Smith,27,Mexico,s3478,Gotham,"Crime TV Shows, TV Action & Adventure, TV Dramas",5 Seasons,3.7554048396462276
8746,Chris Miller,76,Canada,s4430,Chup Chup Ke,"Comedies, Dramas, International Movies",158 min,1.7020311262537946
11643,Katie Martinez,65,UK,s7381,Mahabharat,"Action & Adventure, Dramas, International Movies",119 min,2.5755892104149813
11671,Sarah Brown,64,India,s5957,Just Another Love Story,"Dramas, International Movies",104 min,3.8868524556034743
14516,David Miller,31,Brazil,s234,Count Me In,"Documentaries, Music & Musicals",82 min,1.5848865478361933
7567,Jane Garcia,38,UK,s4482,Baahubali: The Beginning (English Version),"Action & Adventure, Dramas, International Movies",138 min,2.507616611572848
15328,Sarah Brown,17,India,s4264,Demon's Path,"Crime TV Shows, International TV Shows, TV Dramas",1 Season,2.735525954268211
2851,Sarah Johnson,15,Japan,s4672,Sparring,"Dramas, International Movies, Sports Movies",94 min,3.9605824209903946
3080,James Johnson,64,France,s4354,Death by Magic,Reality TV,1 Season,3.0265700334888757
8626,James Williams,34,Germany,s8496,The Runner,"Dramas, Independent Movies",90 min,4.206288447489532
17789,Jane Davis,78,Brazil,s5276,Heroin(e),Documentaries,40 min,0.9420161068385763
17260,Katie Johnson,22,Brazil,s6858,Glowing Embers,"International TV Shows, TV Dramas",1 Season,0.03796065491799838
21056,Alex Jones,13,Brazil,s3178,Triad Princess,"Crime TV Shows, International TV Shows, Romantic TV Shows",1 Season,1.1958120777068604
21678,James Williams,62,UK,s355,The Last Boy Scout,"Action & Adventure, Comedies",105 min,1.4838152672193465
6657,Michael Garcia,62,Mexico,s8513,The Space Between Us,"Action & Adventure, Romantic Movies, Sci-Fi & Fantasy",120 min,0.36108577169684186
8850,Katie Davis,63,UK,s3265,Earthquake Bird,"Dramas, Romantic Movies",107 min,1.641262503192329
15838,Sarah Hernandez,46,Canada,s3620,I'm Brent Morin,Stand-Up Comedy,67 min,0.447669739505695
17125,James Johnson,49,Germany,s7874,Rivaaz,"Dramas, Independent Movies, International Movies",107 min,0.11435243881591561
19429,Katie Hernandez,61,Brazil,s4456,Paan Singh Tomar,"Action & Adventure, Dramas, International Movies",129 min,3.3168665815735734
