14487,James Johnson,46,France,s1209,Çarsi Pazar,"Comedies, International Movies",97 min,2.575279430669256
19308,Emma Johnson,15,Mexico,s37,The Stronghold,"Action & Adventure, Dramas, International Movies",105 min,2.6934292009377776
525,Katie Jones,71,Australia,s4637,American Vandal,"Crime TV Shows, TV Comedies, Teen TV Shows",2 Seasons,2.7860655473168943
6501,Katie Smith,70,USA,s4959,Revolt,"Action & Adventure, Sci-Fi & Fantasy",87 min,3.0408565221236667
11528,Chris Johnson,27,Australia,s8173,Th Eena Meena Deeka Chase Comedy Show,"Kids' TV, TV Comedies",1 Season,2.817271079376203
23468,Jane Hernandez,13,India,s4593,Naan Sigappu Manithan,"Action & Adventure, Dramas, International Movies",147 min,2.636716939445029
12974,Michael Jones,80,Canada,s5827,Real Crime: Diamond Geezers,Documentaries,46 min,4.062166908187552
16897,John Johnson,27,Australia,s7881,Rocky II,"Dramas, Sports Movies",119 min,0.762977230651673
18555,Sarah Martinez,45,Japan,s355,The Last Boy Scout,"Action & Adventure, Comedies",105 min,1.421056639740665
13169,Emma Miller,33,France,s832,The Least Expected Day: Inside the Movistar Team 2019,"Docuseries, International TV Shows, Spanish-Language TV Shows",2 Seasons,4.476495814231673
21629,Sarah Jones,55,Canada,s1620,Oddbods,"Kids' TV, TV Comedies",1 Season,3.579673542789599
1513,David Jones,71,Australia,s7583,Nibunan,"Action & Adventure, Dramas, International Movies",124 min,2.0805644137707584
15063,Sarah Smith,46,UK,s514,Colony,"TV Action & Adventure, TV Dramas, TV Sci-Fi & Fantasy",3 Seasons,3.241420493742051
7627,Chris Williams,47,France,s7906,Running Out Of Time,Thrillers,88 min,1.010139996902566
17625,John Williams,78,Australia,s4780,Mr. Sunshine,"International TV Shows, Korean TV Shows, Romantic TV Shows",1 Season,0.09892342771162077
22053,Michael Garcia,40,Australia,s4678,Ultimate Beastmaster México,"Reality TV, Spanish-Language TV Shows",3 Seasons,2.5404764866980485
9599,David Williams,57,Japan,s2948,Arrow,"Crime TV Shows, TV Action & Adventure",8 Seasons,2.8551147467079154
15299,Emma Williams,62,UK,s5294,Berserk: The Golden Age Arc III - The Advent,"Action & Adventure, Anime Features, International Movies",107 min,4.753641532012853
19992,Sarah Garcia,31,Canada,s6802,French Dirty,"Dramas, Independent Movies",72 min,0.9428567386932019
2175,Chris Smith,37,USA,s8275,The Detained,"Horror Movies, Thrillers",85 min,2.019787733229123
2871,Jane Williams,48,Canada,s8410,The Mad Monk,"Comedies, International Movies, Sci-Fi & Fantasy",85 min,2.949547701235129
14079,James Johnson,56,Germany,s4480,Great News,TV Comedies,2 Seasons,1.6728904918696967
10397,David Brown,15,USA,s939,Motu Patlu in the Game of Zones,"Children & Family Movies, Comedies, Music & Musicals",87 min,3.303781758778813
20619,John Brown,50,Australia,s3599,DC Super Hero Girls,Kids' TV,1 Season,4.264377450962225
16870,Sarah Brown,37,France,s3830,Malibu Rescue,"Children & Family Movies, Comedies",70 min,1.020057324137242
14499,Michael Hernandez,73,UK,s7138,John Day,"International Movies, Thrillers",125 min,0.18261534579669558
811,Katie Williams,32,Australia,s3782,Krutant,"Dramas, International Movies",114 min,2.853592369662414
3519,Sarah Johnson,40,USA,s6822,Gagarin: First in Space,"Dramas, International Movies",108 min,3.3225390774836634
5769,Katie Jones,19,Brazil,s8427,The Monster,"Horror Movies, Independent Movies",91 min,1.4004925119482565
2045,James Garcia,60,UK,s5004,Ravenous,"Horror Movies, International Movies",104 min,3.0243785062378894
5752,Alex Davis,33,Germany,s8263,The Curse of Oak Island,"Docuseries, Science & Nature TV",1 Season,1.879564774956235
4961,Michael Hernandez,52,Canada,s8235,The Cakemaker,"Dramas, Independent Movies, International Movies",109 min,4.657095149061373
23797,James Hernandez,14,Brazil,s2359,Lost Bullet,"Action & Adventure, Dramas, International Movies",93 min,3.5738679911614817
20813,Jane Brown,54,USA,s8174,Thackeray,TV Shows,1 Season,1.3043282033479904
19062,Emma Miller,55,France,s4636,Al Hayba,"Crime TV Shows, International TV Shows, TV Dramas",1 Season,4.093405372505215
13732,David Garcia,40,USA,s2009,Family Business,"International TV Shows, TV Comedies, TV Dramas",2 Seasons,2.3023697899984406
24181,Emma Jones,48,India,s907,Have You Ever Seen Fireflies? - Theatre Play,"Dramas, International Movies",118 min,0.14247100580029537
11255,James Miller,45,UK,s4895,Pocoyo Carnival,Movies,22 min,1.2323096026993423
3624,Jane Smith,78,Australia,s2932,Better Call Saul,"Crime TV Shows, TV Comedies, TV Dramas",4 Seasons,0.36088934890186275
14165,Chris Garcia,32,USA,s8591,Tikli and Laxmi Bomb,"Dramas, International Movies",151 min,2.496564103103335
23427,Jane Brown,36,Germany,s2288,Queen,"Comedies, Dramas, International Movies",138 min,0.34586218180306716
13742,James Jones,32,Germany,s8144,Sym-Bionic Titan,Kids' TV,1 Season,3.4082384822325063
12653,Emma Garcia,19,Brazil,s2795,The Letter for the King,"British TV Shows, International TV Shows, TV Action & Adventure",1 Season,3.0552420165524934
22995,Emma Martinez,63,Brazil,s2841,Angu Vaikuntapurathu (Malayalam),"Action & Adventure, Comedies, Dramas",162 min,1.164576276214
7179,Katie Miller,34,France,s260,Pahuna,"Comedies, Dramas, International Movies",82 min,3.3036335388093545
22053,Michael Garcia,40,Australia,s5975,แผนร้ายนายเจ้าเล่ห์,"International TV Shows, Romantic TV Shows, TV Comedies",1 Season,4.8108248002574605
14799,James Johnson,23,UK,s8644,Twice,"Documentaries, International Movies",53 min,1.792988712698248
13602,Alex Miller,30,France,s4829,Set It Up,"Comedies, Romantic Movies",106 min,4.2531794228225435
11745,Jane Hernandez,23,Japan,s5086,The Reservoir Game,"Documentaries, International Movies",100 min,2.410034554998806
23520,Sarah Miller,63,Canada,s3757,Oprah Presents When They See Us Now,Documentaries,61 min,2.2324046571254987
6141,James Hernandez,28,Germany,s1740,Christmas with a Prince,"Comedies, Dramas, Romantic Movies",86 min,1.583745136588957
17637,Michael Williams,37,India,s6442,Chalay Thay Saath,"Comedies, Dramas, International Movies",118 min,1.5465571156477846
2171,John Davis,16,USA,s7799,Prohibition: A Film by Ken Burns and Lynn Novick,"Crime TV Shows, Docuseries",1 Season,2.1886591017996344
14325,David Davis,14,Japan,s419,Chhota Bheem Ka Roosi Romanch,Children & Family Movies,63 min,2.122655177888117
14387,Emma Davis,19,India,s5166,Longmire,"Crime TV Shows, TV Dramas",6 Seasons,4.772627059429368
6935,Chris Hernandez,33,USA,s8312,The Fosters,TV Dramas,5 Seasons,1.2218782090785119
12268,Katie Smith,18,Brazil,s3290,Jeff Garlin: Our Man In Chicago,Stand-Up Comedy,59 min,1.7729877626667123
1987,Katie Johnson,58,USA,s6469,Child's Play,"Cult Movies, Horror Movies",87 min,1.0041438355621746
17514,David Jones,63,France,s7760,Powder,"Crime TV Shows, International TV Shows, TV Dramas",1 Season,4.897496124787538
658,Alex Garcia,73,Brazil,s5604,Spark,"International TV Shows, Korean TV Shows, Romantic TV Shows",1 Season,2.5538089543165916
21671,Emma Johnson,67,Germany,s8524,The Super Mario Bros. Super Show!,Kids' TV,1 Season,4.433460152740885
4546,James Jones,80,UK,s4911,Moving On,"International TV Shows, TV Dramas",1 Season,2.861192439243821
18887,David Johnson,39,Japan,s3472,Nikki Glaser: Bangin’,Stand-Up Comedy,64 min,3.418835716214297
8888,David Miller,33,USA,s5081,Pyar Ke Do Pal,"Dramas, International Movies, Music & Musicals",153 min,0.5674770717811867
22222,Michael Brown,34,UK,s1072,Motu Patlu in Hong Kong: Kung Fu Kings 3,"Children & Family Movies, Music & Musicals",84 min,3.7440616501126227
5732,Michael Hernandez,71,Mexico,s8461,The Player,"Comedies, International Movies",110 min,3.4513672716764026
22309,Alex Hernandez,52,France,s5044,The Trader (Sovdagari),"Documentaries, International Movies",24 min,3.0991102294842907
8983,Alex Hernandez,40,Germany,s7863,Revenge,"Crime TV Shows, International TV Shows, TV Dramas",1 Season,1.6787727127282652
24724,Katie Smith,38,Australia,s2850,Taylor Tomlinson: Quarter-Life Crisis,Stand-Up Comedy,61 min,1.054270771369663
11249,Alex Brown,60,USA,s359,The Net,Thrillers,114 min,3.843689910946249
21993,Emma Martinez,43,Brazil,s929,Best of the Best,"Action & Adventure, Sports Movies",97 min,1.8643119552703507
16042,Sarah Brown,77,Mexico,s7102,마녀사냥,"International TV Shows, Korean TV Shows, Stand-Up Comedy & Talk Shows",1 Season,1.084013520020467
16715,Katie Martinez,49,Canada,s3579,Diagnosis,"Docuseries, Science & Nature TV",1 Season,4.672580188404157
17552,Emma Brown,38,Japan,s5564,One-Punch Man,"Anime Series, Crime TV Shows, International TV Shows",1 Season,0.47564983234451075
19338,John Smith,66,USA,s3822,Dennis and Gnasher Unleashed,"British TV Shows, Kids' TV, TV Comedies",1 Season,2.810441060750249
23459,Jane Miller,47,France,s7865,Revolting Rhymes,"British TV Shows, Kids' TV",1 Season,2.3559368694464773
25000,James Jones,19,Germany,s224,John of God: The Crimes of a Spiritual Healer,"Crime TV Shows, Docuseries, International TV Shows",1 Season,2.45810534289431
16158,David Hernandez,17,France,s2136,The Legend of Korra,"Kids' TV, TV Action & Adventure, TV Sci-Fi & Fantasy",4 Seasons,3.1003087247509233
11731,James Johnson,71,Germany,s338,Good Luck Chuck,"Comedies, Romantic Movies",99 min,3.1784584974147108
5666,Jane Brown,68,UK,s4909,Goodnight DJ 1,"International TV Shows, TV Dramas, TV Horror",2 Seasons,3.22845537968451
8810,David Jones,59,France,s6406,Calico Critters: A Town of Dreams,Children & Family Movies,11 min,4.240362978340047
20179,Emma Smith,37,Germany,s5715,Divines,"Dramas, Independent Movies, International Movies",107 min,3.591779946568076
20859,Michael Miller,58,Australia,s7210,Kingdoms of the Sky,"British TV Shows, Docuseries, Science & Nature TV",1 Season,1.798551719032132
9073,Jane Williams,13,Brazil,s6725,Extras,"British TV Shows, TV Comedies",2 Seasons,2.2132864638311878
14437,Jane Smith,49,Australia,s8075,Spy Kids,"Children & Family Movies, Comedies",88 min,0.640668582579636
12965,Katie Smith,44,Germany,s6505,Club Friday The Series 6,"International TV Shows, Romantic TV Shows, TV Dramas",9 Seasons,0.5238604727335072
9924,David Hernandez,51,USA,s6836,Genius of the Modern World,"British TV Shows, Docuseries, International TV Shows",1 Season,0.11333651281800694
18948,David Jones,79,Mexico,s7724,Pekak,"Dramas, International Movies",95 min,1.364967927198864
1260,Sarah Martinez,66,Canada,s4952,Loaded,"British TV Shows, International TV Shows, TV Comedies",1 Season,0.9747399195412121
9099,Alex Johnson,64,Mexico,s1252,Dances with Wolves,"United States, United Kingdom","Jimmy Herman\"",0.5428879574709911
16302,Jane Martinez,25,Germany,s2925,French Toast,"Comedies, International Movies, Romantic Movies",86 min,3.0573751177573385
6485,John Johnson,79,Japan,s6627,Don't Be Afraid of the Dark,Horror Movies,99 min,3.3884466614059354
14862,Chris Brown,41,France,s5232,ID-0,"Anime Series, International TV Shows",1 Season,2.664270587825551
9077,Michael Smith,65,Australia,s7588,Nights in Rodanthe,"Dramas, Romantic Movies",97 min,4.940819595341222
19868,Chris Johnson,28,Japan,s5492,Sahara,Children & Family Movies,86 min,0.23537617210965311
6478,Sarah Garcia,26,Australia,s5522,Hot Girls Wanted: Turned On,Docuseries,1 Season,3.849165686684054
17206,Jane Martinez,50,France,s1684,Well Done Abba,"Comedies, International Movies",135 min,2.373000927554511
14942,John Brown,58,Brazil,s666,Deadwind,"Crime TV Shows, International TV Shows, TV Dramas",2 Seasons,3.774911645168042
22507,Katie Miller,65,Japan,s589,Rainbow Rangers,Kids' TV,1 Season,4.7862006685880845
13239,Michael Martinez,34,India,s833,Word of Honor,"International TV Shows, TV Action & Adventure, TV Dramas",1 Season,0.7572655399190098
5769,Katie Jones,19,Brazil,s3677,The Milk System,"Documentaries, International Movies",91 min,4.030995832625975
17483,Alex Brown,70,India,s2128,3%,"International TV Shows, TV Dramas, TV Sci-Fi & Fantasy",4 Seasons,3.15610927149209
18479,David Brown,50,Australia,s7575,Nature's Weirdest Events,"British TV Shows, Docuseries, Science & Nature TV",3 Seasons,4.323851908648654
9103,Alex Brown,23,UK,s6875,Good Kids,"Comedies, Independent Movies",90 min,1.5320436961014616
7403,Alex Brown,40,USA,s5227,The Babysitter,"Comedies, Horror Movies",85 min,0.8408024145757531
3217,Jane Martinez,26,UK,s7878,Robin Hood: The Rebellion,"Action & Adventure, Independent Movies, International Movies",92 min,0.7832125406886697
2302,Chris Brown,78,USA,s2079,The Promised Neverland,"Anime Series, International TV Shows, TV Thrillers",1 Season,4.327899034353243
6222,Emma Martinez,60,Canada,s2251,The Old Guard,Action & Adventure,126 min,2.5073601569082644
4700,Chris Brown,54,UK,s8357,The Imaginarium of Doctor Parnassus,"Action & Adventure, Sci-Fi & Fantasy",123 min,1.1619508856659762
11219,Sarah Jones,26,Germany,s8798,Zak Storm,Kids' TV,3 Seasons,0.86503621609129
5589,John Garcia,16,France,s6419,Cappuccino,"Comedies, Dramas, International Movies",126 min,2.8539279921710663
12550,David Miller,14,India,s2791,Greenhouse Academy,"Kids' TV, TV Dramas, Teen TV Shows",4 Seasons,4.858948802796665
14398,John Smith,64,Australia,s140,Do the Right Thing,"Classic Movies, Comedies, Dramas",120 min,3.2172062414822653
17128,Katie Martinez,58,Mexico,s3661,Unrequited Love,"International TV Shows, Romantic TV Shows, TV Dramas",1 Season,1.2989416083085714
9443,Chris Hernandez,14,Canada,s8125,Super Nani,"Comedies, Dramas, International Movies",127 min,2.892128007760646
5639,Alex Williams,37,Mexico,s5312,The Guardian Brothers,"Children & Family Movies, Comedies",86 min,0.5042269666909882
11181,Sarah Miller,56,Japan,s6546,Cutie and the Boxer,Documentaries,82 min,4.228301202792844
61,Alex Hernandez,70,Canada,s3472,Nikki Glaser: Bangin’,Stand-Up Comedy,64 min,1.413310088980546
19060,Alex Brown,38,Brazil,s7904,Runaway Bride,"Comedies, Romantic Movies",116 min,3.6299032336454373
15383,Michael Smith,17,Brazil,s2405,Curon,"International TV Shows, TV Dramas, TV Horror",1 Season,0.14266403201095734
11048,Chris Davis,68,Japan,s6935,Harry Benson: Shoot First,Documentaries,90 min,2.6949991558453457
11223,Emma Davis,13,Germany,s1645,Fantastica,"Comedies, International Movies, LGBTQ Movies",114 min,4.9072948773630625
5983,Emma Jones,37,UK,s1779,Kongsuni and Friends,"Kids' TV, Korean TV Shows",2 Seasons,1.2516343537063535
19551,David Johnson,38,USA,s1625,The Da Vinci Code,Thrillers,149 min,0.8880788765022141
15485,Katie Davis,71,UK,s7213,Kis Kisko Pyaar Karoon,"Comedies, International Movies",132 min,4.568438814660182
11081,Michael Brown,62,UK,s8505,The Shaukeens,"Comedies, International Movies, Music & Musicals",123 min,0.5944311957229009
23862,Michael Brown,32,Mexico,s4991,Stretch Armstrong: The Breakout,Children & Family Movies,104 min,2.4371057352253733
1206,Jane Brown,45,Brazil,s3509,True: Tricky Treat Day,Children & Family Movies,24 min,4.3997578397950425
21549,Michael Smith,37,Mexico,s5888,Walt Disney Animation Studios Short Films Collection,Children & Family Movies,90 min,4.442701951685169
1556,James Williams,63,France,s7102,마녀사냥,"International TV Shows, Korean TV Shows, Stand-Up Comedy & Talk Shows",1 Season,4.221667836230914
22769,David Brown,63,USA,s1589,Mighty Express: A Mighty Christmas,Children & Family Movies,26 min,0.6089938367038533
17333,Katie Smith,72,Australia,s6599,Deviant Love,Thrillers,87 min,3.649946172224374
19652,Katie Williams,74,Japan,s3785,March Comes in Like a Lion,"Anime Series, International TV Shows, Teen TV Shows",2 Seasons,1.2536442602102333
1753,John Johnson,30,UK,s4229,Whitney Cummings: Money Shot,Stand-Up Comedy,48 min,4.922291419883848
20920,Alex Miller,49,USA,s6046,A Mission in an Old Movie,"Comedies, International Movies",98 min,1.2179203602418327
16073,Emma Brown,49,France,s1266,The Girl on the Train,"International Movies, Thrillers",120 min,0.08027726132571855
21355,James Miller,64,Brazil,s1448,Case 39,"Horror Movies, Thrillers",111 min,0.45231866057389547
13328,Alex Martinez,28,Canada,s2884,The Trials of Gabriel Fernandez,"Crime TV Shows, Docuseries",1 Season,2.4565604731745196
5675,David Garcia,37,France,s1030,Doctor Bello,"Dramas, International Movies",96 min,3.49932178702539
5762,David Davis,43,USA,s2060,Adrift,"Action & Adventure, Dramas, Romantic Movies",96 min,4.396406177910733
24491,Michael Jones,46,France,s5175,Glitter Force Doki Doki,"Anime Series, Kids' TV",2 Seasons,3.198070722837187
14616,John Williams,13,USA,s8665,Up in the Air,"Comedies, Dramas, Romantic Movies",110 min,2.5798597438531568
8381,John Martinez,32,Brazil,s7797,Princess Cyd,"Dramas, Independent Movies, LGBTQ Movies",97 min,3.7269448595351196
9560,Jane Smith,57,USA,s6406,Calico Critters: A Town of Dreams,Children & Family Movies,11 min,1.4521246662562164
11350,John Johnson,75,Canada,s8271,The Dawn Wall,"Documentaries, Sports Movies",100 min,0.7386573281839354
2594,Jane Brown,26,France,s3546,Uncle Naji in UAE,"Comedies, International Movies",95 min,4.397907581875404
4517,John Davis,57,Mexico,s5443,Headshot,"Action & Adventure, International Movies",119 min,0.22345459257335276
15531,Chris Jones,49,Australia,s1382,Hire a Woman,"Comedies, International Movies, Romantic Movies",108 min,0.5231049511815011
14374,James Williams,39,UK,s6490,City of Tiny Lights,"Dramas, International Movies, Thrillers",110 min,1.635887779347935
16789,Emma Brown,20,USA,s533,Scream,"Crime TV Shows, TV Horror, TV Mysteries",3 Seasons,3.0536792356369475
6849,James Davis,30,Germany,s6198,Auschwitz: Blueprints of Genocide,Documentaries,49 min,2.7234686681953324
9632,Chris Miller,65,India,s568,Congo,"Action & Adventure, Thrillers",108 min,1.2926072039903542
4852,Alex Hernandez,41,UK,s3673,Kidnapping Stella,"Dramas, International Movies, Thrillers",90 min,0.42810814456511526
9792,Alex Miller,70,Australia,s1878,Private Lives,"Crime TV Shows, International TV Shows, TV Dramas",1 Season,0.27524212918270174
20900,Jane Jones,23,Mexico,s5043,The Ritual,"Horror Movies, International Movies, Thrillers",95 min,1.3208318508815027
16657,Sarah Hernandez,18,France,s7308,Limmy's Show!,"British TV Shows, TV Comedies",2 Seasons,4.984881698407305
12603,Michael Hernandez,44,Australia,s5015,Swades,"Dramas, International Movies",185 min,1.6614334776203172
23557,Jane Brown,77,Brazil,s7608,NOVA: Extreme Animal Weapons,Documentaries,53 min,2.9472335371218095
9592,James Smith,37,Australia,s7647,Oh No! It's an Alien Invasion,"Kids' TV, TV Action & Adventure, TV Sci-Fi & Fantasy",2 Seasons,4.82957785857315
4821,Emma Williams,72,Japan,s8068,Spider-Man 3,"Action & Adventure, Sci-Fi & Fantasy",139 min,0.5240894364707738
7884,Michael Miller,76,France,s2972,Diablero,"International TV Shows, Spanish-Language TV Shows, TV Action & Adventure",2 Seasons,3.4503889872881266
18064,Katie Brown,36,UK,s3955,Love O2O,"International Movies, Romantic Movies, Sci-Fi & Fantasy",103 min,1.2654712651531659
7636,Jane Hernandez,48,Japan,s591,Sailor Moon Crystal,"Anime Series, Kids' TV",3 Seasons,2.4712236376362444
19150,Michael Jones,34,India,s271,Beckett,Action & Adventure,110 min,4.831305517643469
11284,James Davis,15,Germany,s4572,Jagga Jasoos,"Action & Adventure, Comedies, International Movies",155 min,3.7043143534991274
24221,Alex Williams,46,Australia,s2726,Gumrah,"Action & Adventure, Dramas, International Movies",149 min,4.219207128016177
7302,Emma Garcia,16,Australia,s1558,Canvas,"Children & Family Movies, Dramas",9 min,3.81063837770754
12432,Sarah Garcia,26,Germany,s4130,Safe,"British TV Shows, Crime TV Shows, International TV Shows",1 Season,4.395797392964767
9151,Michael Smith,57,Australia,s1548,Teen Mom 2,Reality TV,2 Seasons,0.8076691375032996
1229,Sarah Hernandez,68,Japan,s307,'76,"Dramas, International Movies",118 min,0.20813669278644142
266,John Miller,65,India,s5451,How to Stage a Coup,Documentaries,47 min,2.8058194006019437
19102,John Davis,43,Australia,s3986,The Dirt,"Comedies, Dramas, Music & Musicals",108 min,1.5258598365725646
16643,Chris Davis,42,Brazil,s3511,When the Camellia Blooms,"International TV Shows, Korean TV Shows, Romantic TV Shows",1 Season,0.0708641692145906
581,Emma Hernandez,68,USA,s812,Super Monsters: Once Upon a Rhyme,Children & Family Movies,25 min,0.2916271440244389
1417,Katie Martinez,28,India,s1144,Worn Stories,"Docuseries, Reality TV",1 Season,1.0013818083725052
3458,Alex Jones,49,Australia,s8625,Tremors 4: The Legend Begins,"Comedies, Horror Movies, Sci-Fi & Fantasy",101 min,2.247131163163475
5560,Katie Williams,45,Brazil,s8541,The Tuxedo,"Action & Adventure, Comedies",99 min,2.8723575054073596
18026,Katie Hernandez,60,Japan,s2000,Hope Frozen: A Quest to Live Twice,"Documentaries, International Movies",80 min,2.2130142783995215
16703,Chris Johnson,44,Canada,s822,The Wedding Guest,"Dramas, Romantic Movies, Thrillers",97 min,4.959384503212191
181,Alex Garcia,47,Canada,s1227,The Houseboat,"Docuseries, International TV Shows",1 Season,2.212450209726538
8817,Emma Hernandez,27,India,s8450,The Pelican Brief,"Dramas, Thrillers",141 min,1.4158218039945054
22942,James Smith,67,France,s1637,Dance Dreams: Hot Chocolate Nutcracker,"Children & Family Movies, Documentaries",81 min,1.882963033652143
21649,Emma Garcia,18,Japan,s5264,Dark Matter,"TV Sci-Fi & Fantasy, TV Thrillers",3 Seasons,3.2606243596018376
10686,Alex Hernandez,31,Brazil,s8174,Thackeray,TV Shows,1 Season,2.1084286693656322
24465,Emma Davis,80,Canada,s4572,Jagga Jasoos,"Action & Adventure, Comedies, International Movies",155 min,4.770127486353864
16183,James Hernandez,64,Australia,s6859,God Bless the Broken Road,"Children & Family Movies, Dramas, Faith & Spirituality",111 min,3.603168145193642
16681,Katie Jones,43,Japan,s5428,What the Health,Documentaries,92 min,4.3490133104382185
23936,Alex Brown,32,Germany,s8530,The Tiger Hunter,"Comedies, Dramas, Independent Movies",94 min,4.563630238436454
3477,Emma Brown,74,Canada,s5305,Mujrim,"Action & Adventure, Dramas, International Movies",163 min,3.4771539908151476
22856,Sarah Smith,21,Japan,s1917,Rize,"Documentaries, Music & Musicals",87 min,0.7075573542919705
7886,Michael Johnson,70,India,s1840,La Révolution,"International TV Shows, TV Action & Adventure, TV Dramas",1 Season,2.550320887875289
9507,John Hernandez,72,India,s8495,THE RUM DIARY,"Comedies, Dramas",120 min,2.0775145205225467
4935,John Smith,28,India,s8369,The Irish Mob,"Crime TV Shows, Docuseries",1 Season,2.1298616406099957
13593,Michael Johnson,41,Japan,s3367,Little Miss Sumo,"Documentaries, International Movies, Sports Movies",20 min,2.790967574655773
9662,James Jones,15,Australia,s2277,Inkaar,"Dramas, International Movies, Romantic Movies",125 min,0.335492924609313
15223,John Miller,67,Germany,s858,The Neighbor,"International TV Shows, Spanish-Language TV Shows, TV Comedies",2 Seasons,2.9097803251207512
8401,David Garcia,39,Mexico,s6761,FirstBorn,"Horror Movies, International Movies",90 min,0.8909218192856849
9030,Emma Smith,13,India,s4775,Jim Jefferies: This Is Me Now,Stand-Up Comedy,71 min,3.8455935291752716
23575,Emma Johnson,22,Canada,s7008,Hotel Pacific,"Classic Movies, Dramas, International Movies",96 min,1.253583861860822
18955,David Hernandez,50,Japan,s7960,Scooby-Doo on Zombie Island,Children & Family Movies,77 min,1.6974406851686852
12425,Alex Jones,69,Brazil,s7620,November Criminals,"Dramas, Thrillers",86 min,0.9004983424491236
6311,Emma Davis,24,Japan,s3565,Marriage Palace,"Comedies, International Movies",135 min,3.4253883689422877
14162,David Miller,36,Canada,s7477,Mohawk,"Action & Adventure, Horror Movies, Independent Movies",92 min,4.641895338229115
594,Chris Miller,30,UK,s7258,La Rosa de Guadalupe,"Classic & Cult TV, Crime TV Shows, International TV Shows",1 Season,1.2301564646412344
22338,Chris Hernandez,53,India,s1751,Dawson's Creek,"Romantic TV Shows, TV Dramas, Teen TV Shows",6 Seasons,4.699858421908841
12838,Jane Brown,79,Canada,s5709,Michael Che Matters,Stand-Up Comedy,61 min,4.915498245106781
13674,Michael Jones,17,France,s3143,Lakshya,"Action & Adventure, Dramas, International Movies",185 min,2.4205203756264955
22364,Chris Hernandez,39,Japan,s4020,Everything About Her,"Comedies, Dramas, International Movies",127 min,4.713456563098433
3734,Michael Johnson,50,UK,s832,The Least Expected Day: Inside the Movistar Team 2019,"Docuseries, International TV Shows, Spanish-Language TV Shows",2 Seasons,0.058873493158727586
2774,David Williams,73,UK,s3645,Beat Bugs,Kids' TV,3 Seasons,3.901248588128236
21752,Michael Brown,16,France,s6003,2307: Winter's Dream,"Action & Adventure, Independent Movies, Sci-Fi & Fantasy",101 min,4.652879310657171
7533,Michael Miller,25,Mexico,s350,Seabiscuit,"Dramas, Sports Movies",141 min,0.5593913212439794
16006,Alex Johnson,22,Brazil,s4767,El club de los buenos infieles,"Comedies, International Movies",85 min,0.8650760589098572
3180,Chris Davis,68,India,s7125,Jeremy Scott: The People's Designer,Documentaries,109 min,2.6822130086947134
5611,John Jones,33,USA,s140,Do the Right Thing,"Classic Movies, Comedies, Dramas",120 min,4.66214127365519
8383,Katie Garcia,29,France,s6591,Delirium,"Horror Movies, Thrillers",96 min,3.3394375980753708
22189,James Jones,60,Germany,s4261,Stand Up and Away! with Brian Regan,"Stand-Up Comedy & Talk Shows, TV Comedies",1 Season,0.4095080649893079
24271,Alex Davis,18,Australia,s6614,Dino Hunt,"Docuseries, Science & Nature TV",1 Season,4.790170558276176
12573,John Williams,66,Mexico,s5474,War Machine,"Comedies, Dramas",123 min,4.025351366091599
13536,Chris Miller,57,France,s7799,Prohibition: A Film by Ken Burns and Lynn Novick,"Crime TV Shows, Docuseries",1 Season,1.8527727819006294
19347,John Martinez,51,USA,s4310,Tidelands,"Crime TV Shows, International TV Shows, TV Dramas",1 Season,0.28618826953758614
5603,Katie Davis,61,Canada,s1412,What Would Sophia Loren Do?,32 min,TV-14,2.370098646943081
5989,Sarah Hernandez,55,Australia,s822,The Wedding Guest,"Dramas, Romantic Movies, Thrillers",97 min,4.504868923163073
6624,Jane Garcia,36,UK,s4786,Sommore: Chandelier Status,Stand-Up Comedy,77 min,2.13829077134975
19229,John Miller,49,Canada,s875,Booba: Food Puzzle,Kids' TV,1 Season,1.5064557393857307
