12969,Jane Smith,24,Japan,s5023,반드시 잡는다,"Dramas, International Movies, Thrillers",110 min,3.295812357197426
1644,Michael Martinez,71,UK,s1412,What Would Sophia Loren Do?,32 min,TV-14,2.879622136057363
8850,Katie Davis,63,UK,s779,Attack on Titan,"Anime Series, International TV Shows",1 Season,3.1388673296612764
15595,Chris Williams,34,France,s6652,"Drugs, Inc.","Crime TV Shows, Docuseries",1 Season,3.8931813596668126
21142,Michael Hernandez,62,India,s417,Chhota Bheem aur Krishna vs Zimbara,Children & Family Movies,64 min,4.633327318661648
6797,Jane Williams,14,India,s27,Minsara Kanavu,"Comedies, International Movies, Music & Musicals",147 min,1.595431349976562
17172,Chris Davis,22,Australia,s5161,Beat Bugs: All Together Now,"Children & Family Movies, Music & Musicals",51 min,0.9821678098997755
13914,Alex Davis,20,Canada,s8480,The Redeemed and the Dominant: Fittest on Earth,"Documentaries, Sports Movies",120 min,3.9151422995185796
23173,Emma Martinez,32,France,s7177,Ken Burns: The Roosevelts: An Intimate History,Docuseries,1 Season,2.3581909118918825
15861,Katie Smith,53,Australia,s2479,Modest Heroes: Ponoc Short Films Theatre,"Anime Features, Children & Family Movies",54 min,3.4100644283288517
19808,Jane Brown,42,Brazil,s3360,Mehandi Circus,"Dramas, International Movies, Romantic Movies",126 min,2.3516866274588413
15828,Katie Garcia,64,Mexico,s7389,Mala Kahich Problem Nahi,"Dramas, International Movies",132 min,0.12983490412782628
24249,Alex Martinez,19,India,s4309,The Innocent Man,"Crime TV Shows, Docuseries",1 Season,1.3305805681552618
21381,Michael Brown,33,Canada,s7060,In Between,"International TV Shows, Romantic TV Shows, TV Comedies",1 Season,1.595732932923969
19830,Sarah Jones,62,Mexico,s8218,The Book of Eli,"Action & Adventure, Sci-Fi & Fantasy",118 min,3.697892642010183
12956,David Martinez,66,Mexico,s6593,Den of Thieves,Action & Adventure,140 min,0.5175088765844205
19853,John Hernandez,44,UK,s8708,"We, the Marines","Documentaries, International Movies",38 min,2.648357755206039
19701,Alex Davis,55,UK,s993,Perfume Imaginary Museum “Time Warp”,"International Movies, Music & Musicals",54 min,3.6272913866458594
6141,James Hernandez,28,Germany,s3670,Bonus Family,"International TV Shows, TV Dramas",3 Seasons,3.4707786444846525
22931,James Martinez,73,USA,s1368,Hell Fest,Horror Movies,89 min,1.6097345840254296
23852,John Garcia,57,USA,s2342,Athlete A,"Documentaries, Sports Movies",104 min,2.453753495103084
5459,John Smith,36,Canada,s7068,Incredibles 2 (Spanish Version),"Children & Family Movies, Comedies",118 min,1.5351144247270705
7396,Alex Davis,43,India,s6006,27: Gone Too Soon,Documentaries,70 min,3.3393940308807073
14452,John Jones,53,Germany,s7994,Shaka Zulu,TV Dramas,1 Season,1.4894567513729529
22274,Sarah Hernandez,36,USA,s1580,Mr. Iglesias,"TV Comedies, Teen TV Shows",3 Seasons,0.9145945690652302
21871,Emma Smith,22,Australia,s3494,Oh! Baby (Tamil),"Comedies, International Movies, Music & Musicals",146 min,0.7968626221428265
22067,Katie Johnson,44,France,s1926,You Cannot Hide,"Crime TV Shows, International TV Shows, Spanish-Language TV Shows",1 Season,4.5572277840876385
12967,James Davis,36,Germany,s756,Kitty Love: An Homage to Cats,"Children & Family Movies, Documentaries, International Movies",61 min,4.771701342695992
2560,Michael Hernandez,50,Canada,s4578,Khoobsurat,"Comedies, International Movies, Romantic Movies",121 min,3.568702841854315
15593,Jane Miller,29,Australia,s1793,Guillermo Vilas: Settling the Score,"Documentaries, International Movies, Sports Movies",95 min,4.769863262242048
16230,James Davis,56,Canada,s4943,Wakfu,Kids' TV,3 Seasons,1.260811972689334
20940,Alex Hernandez,17,UK,s8180,The Adderall Diaries,"Dramas, Thrillers",87 min,0.892766608559798
7316,Emma Garcia,53,UK,s6250,Bat Pat,Kids' TV,1 Season,1.2328855512569632
4542,Katie Jones,21,Canada,s8489,The River Thief,"Dramas, Independent Movies",87 min,1.1623205563691241
5532,Chris Jones,75,France,s7929,Samson,"Action & Adventure, Dramas, Faith & Spirituality",109 min,4.736362070055611
20077,Emma Smith,24,Brazil,s5661,Gabriel lglesias: I’m Sorry For What I Said When I Was Hungry,Stand-Up Comedy,88 min,2.870997058024834
10170,Alex Miller,32,France,s4500,S Storm,"Action & Adventure, International Movies",95 min,0.18484927383831784
14645,Alex Garcia,29,Mexico,s137,Cold Mountain,"Dramas, Romantic Movies",154 min,0.756761107728543
15962,James Martinez,43,Germany,s1264,No Escape,Action & Adventure,103 min,4.255396540723301
3081,Michael Williams,58,UK,s3304,Luccas Neto in: Summer Camp,"Children & Family Movies, Comedies, Music & Musicals",87 min,3.1325636332657614
6133,Chris Hernandez,24,Mexico,s8765,Wyatt Earp,Action & Adventure,191 min,4.768764824566175
14551,Chris Johnson,76,India,s7968,Secret,"Dramas, International Movies, Music & Musicals",101 min,3.815217392022699
10537,Sarah Jones,77,Japan,s1236,Pokémon Journeys: The Series,"Anime Series, Kids' TV, TV Action & Adventure",4 Seasons,2.889482476396161
1948,Katie Martinez,16,UK,s5340,Baahubali: The Beginning (Tamil Version),"Action & Adventure, Dramas, International Movies",159 min,3.0530358939700464
13757,Michael Brown,55,France,s5522,Hot Girls Wanted: Turned On,Docuseries,1 Season,3.848939558998254
6999,Michael Brown,78,Canada,s5549,Life 2.0,Documentaries,99 min,3.062328713108587
9909,Chris Johnson,40,Germany,s6800,Freeway: Crack in the System,Documentaries,103 min,1.6929995243304752
3745,Katie Brown,36,UK,s3375,It Takes a Lunatic,Documentaries,127 min,2.2893906310449
15416,Katie Johnson,59,Mexico,s1055,Wave of Cinema: One Day We'll Talk About Today,"Documentaries, International Movies, Music & Musicals",71 min,2.841478223257154
4622,Katie Hernandez,27,Australia,s7688,P,"Horror Movies, International Movies",105 min,4.481092766639684
16045,David Garcia,23,UK,s1922,The Outpost,"Action & Adventure, Dramas",123 min,3.981992102123812
8154,Chris Miller,35,Germany,s8502,The Secret Life of Pets 2,"Children & Family Movies, Comedies",86 min,3.338299325096221
12961,John Hernandez,29,Mexico,s8476,The Rat Race,"Documentaries, International Movies",52 min,1.206643671563814
793,Chris Hernandez,15,USA,s1695,Cloudy with a Chance of Meatballs 2,"Children & Family Movies, Comedies",95 min,4.58223631017909
12321,John Johnson,57,Germany,s4586,Motor Mitraan Di,"Comedies, International Movies",117 min,4.676549258049115
17150,Alex Smith,43,France,s1836,I Am Vengeance: Retaliation,Action & Adventure,82 min,1.068734944640224
12474,James Smith,47,Japan,s8711,Weeds,"TV Comedies, TV Dramas",8 Seasons,3.6597917589427134
2523,Jane Jones,79,Australia,s4306,Inside the Real Narcos,"British TV Shows, Crime TV Shows, Docuseries",1 Season,0.48248261871724873
17135,John Hernandez,20,Japan,s3930,Liss Pereira: Reteniendo líquidos,Stand-Up Comedy,59 min,1.3095920605135725
245,Chris Brown,35,UK,s1939,Ankhon Dekhi,"Dramas, Independent Movies, International Movies",104 min,2.6855752064088074
1848,Chris Davis,29,Brazil,s2427,BAKI,"Anime Series, International TV Shows",3 Seasons,4.530812224570786
18145,Katie Hernandez,56,Germany,s3469,Limitless,"Documentaries, International Movies, Sports Movies",59 min,3.5874954530891126
5535,Chris Hernandez,71,Japan,s3337,Haikyu!!,"Anime Series, International TV Shows, Teen TV Shows",2 Seasons,3.555930056766587
11168,Jane Williams,63,Brazil,s8631,Trip to Bhangarh: Asia's Most Haunted Place,"International Movies, Thrillers",113 min,0.27551985095919884
13696,Jane Davis,43,USA,s8098,Storage Wars: Northern Treasures,"International TV Shows, Reality TV",1 Season,3.7490537128805594
941,Sarah Martinez,69,India,s8390,The Last Whistle,"Dramas, Sports Movies",88 min,1.3961373887685942
24993,James Brown,47,India,s1266,The Girl on the Train,"International Movies, Thrillers",120 min,3.7245778540965606
19748,Chris Miller,76,Australia,s7767,Power Rangers Lightspeed Rescue,Kids' TV,1 Season,0.9061642862908914
16767,Chris Johnson,52,Australia,s2697,The Trial,"Crime TV Shows, International TV Shows, TV Dramas",1 Season,3.8185037465858853
7621,Alex Hernandez,80,Australia,s4934,AMO,"International TV Shows, TV Dramas",1 Season,2.662371252789783
21734,Jane Williams,14,UK,s3456,Super Monsters,Kids' TV,3 Seasons,4.382939927517259
11938,Emma Williams,45,France,s7218,Knights of Sidonia,"Anime Series, International TV Shows",2 Seasons,3.5117786451453603
23906,James Hernandez,42,India,s1922,The Outpost,"Action & Adventure, Dramas",123 min,1.7594203907337946
22335,Sarah Williams,26,Germany,s4309,The Innocent Man,"Crime TV Shows, Docuseries",1 Season,4.801032013751279
5208,Michael Williams,73,USA,s513,Code Lyoko,Kids' TV,4 Seasons,4.315086131139927
2252,John Miller,52,India,s8316,The Furchester Hotel,"British TV Shows, Kids' TV",2 Seasons,3.4156839635132052
7245,Michael Jones,32,Germany,s3781,Arthdal Chronicles,"International TV Shows, Korean TV Shows, TV Action & Adventure",1 Season,4.420839116114793
21489,Alex Williams,61,France,s6977,History's Greatest Hoaxes,"British TV Shows, Docuseries",1 Season,0.4197190839764209
2238,John Williams,26,Japan,s269,Unroyal,"Dramas, International Movies",97 min,2.286954267275739
24453,David Williams,24,Germany,s1122,Legally Blonde,"Comedies, Romantic Movies",96 min,1.710664869305446
9129,John Brown,64,Australia,s6060,A Tale of Love and Darkness,"Dramas, International Movies",98 min,3.3903038598413198
18094,John Garcia,43,UK,s8032,Skin Wars: Fresh Paint,Reality TV,1 Season,1.8734998652921186
4052,Jane Johnson,57,Germany,s7750,Planet Hulk,"Action & Adventure, Sci-Fi & Fantasy",81 min,4.645705661505865
6084,Katie Garcia,54,Canada,s1606,Check The Store Next Door: The Next Chapter,"International TV Shows, TV Comedies, TV Dramas",2 Seasons,4.078722204924507
4202,Katie Johnson,38,France,s8331,The Great Battle,"Action & Adventure, Dramas, International Movies",136 min,4.669220061702643
7063,John Hernandez,71,France,s6695,Encounter: The Killing,"Dramas, Independent Movies, International Movies",151 min,1.4321107189362996
11944,Sarah Davis,20,Brazil,s1633,Spookley and the Christmas Kittens,Children & Family Movies,45 min,4.7447480885169435
17805,Emma Martinez,16,Germany,s8755,Wolves,"Dramas, Independent Movies, Sports Movies",109 min,2.193345509535098
11287,Sarah Garcia,54,USA,s8357,The Imaginarium of Doctor Parnassus,"Action & Adventure, Sci-Fi & Fantasy",123 min,2.6274166371532215
8570,Chris Miller,40,Canada,s2541,The Wrong Missy,"Comedies, Romantic Movies",90 min,3.039302938868562
24619,Katie Garcia,61,Australia,s5614,"Michael Bolton's Big, Sexy Valentine's Day Special","Comedies, Music & Musicals, Romantic Movies",54 min,2.7526055709782677
23981,Jane Brown,26,Brazil,s4194,Sebastian Maniscalco: Stay Hungry,Stand-Up Comedy,65 min,1.5101730135976639
11537,John Davis,41,USA,s7196,Kidnapping Mr. Heineken,"Action & Adventure, Dramas, International Movies",95 min,1.3285660751080652
19581,Michael Miller,31,Australia,s7818,Rachel Getting Married,"Dramas, Independent Movies",113 min,4.7989458685622335
12400,Alex Miller,71,Japan,s3292,Put Your Head on My Shoulder,"International TV Shows, Romantic TV Shows, Teen TV Shows",1 Season,4.834426426065791
20397,Katie Smith,77,UK,s6498,Click,"Comedies, Sci-Fi & Fantasy",108 min,1.0209525010271352
9983,James Brown,29,Brazil,s7437,MegaTruckers,Reality TV,1 Season,1.7153794951014207
18196,David Miller,30,Australia,s4431,Creators,"Kids' TV, Spanish-Language TV Shows",2 Seasons,2.6769551431179055
11232,Michael Garcia,21,Japan,s1668,Flavorful Origins,"Docuseries, International TV Shows",3 Seasons,4.864456124778945
16197,Katie Johnson,43,Brazil,s4269,Bird Box,"Dramas, Sci-Fi & Fantasy, Thrillers",124 min,2.30501152704817
1300,Katie Davis,61,Australia,s6186,Arthur,"Comedies, Romantic Movies",110 min,3.359132060428917
13359,Alex Brown,80,Japan,s1026,Bakugan: Geogan Rising,"Anime Series, Kids' TV",1 Season,0.9649258757569362
11504,Sarah Hernandez,42,France,s8023,Sin Senos sí Hay Paraíso,"International TV Shows, Spanish-Language TV Shows, TV Dramas",3 Seasons,1.2065449674970952
23910,Alex Miller,18,India,s238,Boomika (Hindi),"Horror Movies, International Movies, Thrillers",122 min,1.7965749930578523
11295,Alex Jones,66,France,s1938,Amandla! A Revolution in Four Part Harmony,"Documentaries, International Movies, Music & Musicals",103 min,3.3706025969105187
11313,Jane Miller,17,Canada,s8121,Sunrise,"Dramas, Independent Movies, International Movies",85 min,2.893982901165535
24561,Sarah Miller,57,Japan,s3466,First Kiss,"Dramas, International Movies, Romantic Movies",90 min,1.3083733000899689
17828,Jane Davis,67,France,s5220,Seven and Me,Kids' TV,1 Season,3.320877122050536
17221,John Brown,48,Mexico,s2821,Justine,"Dramas, Independent Movies",106 min,1.0104555310809937
16909,Sarah Martinez,43,Mexico,s1067,The Soul,"Dramas, International Movies, Thrillers",130 min,4.2599961824145485
9386,Emma Miller,58,UK,s861,Hating Peter Tatchell,"Documentaries, International Movies, LGBTQ Movies",91 min,4.375503503981189
16558,James Brown,37,India,s2122,Seventh Son,"Action & Adventure, Sci-Fi & Fantasy",102 min,3.7850572442602064
14798,Jane Hernandez,37,Japan,s8578,This Was Tomorrow,"Documentaries, International Movies, Music & Musicals",77 min,1.8867612650920145
5452,David Smith,14,UK,s1911,"Good Morning, Verônica","Crime TV Shows, International TV Shows, TV Mysteries",1 Season,2.864046365756374
15414,Katie Martinez,72,Mexico,s5273,VeggieTales in the City,Kids' TV,2 Seasons,2.4587033465179156
3845,Michael Martinez,68,India,s8524,The Super Mario Bros. Super Show!,Kids' TV,1 Season,3.9355006666185854
24516,Chris Hernandez,64,Canada,s6607,Diana: 7 Days That Shook the World,Documentaries,93 min,3.0411506382386437
18816,Michael Williams,68,India,s949,Swiped,Comedies,94 min,4.286322756359833
4795,John Smith,25,Brazil,s5105,The Climb,"Action & Adventure, Comedies, Dramas",105 min,2.9727187017641965
23958,Michael Miller,51,Japan,s3860,All In My Family,"Documentaries, LGBTQ Movies",40 min,3.059849847972979
2694,Sarah Johnson,58,Japan,s447,The Book of Henry,Dramas,105 min,3.019157593076931
17828,Jane Davis,67,France,s4060,Paranormal Investigation,"Horror Movies, International Movies, Thrillers",93 min,2.5774790787738233
15804,Alex Hernandez,58,France,s8444,The One I Love,"Comedies, Dramas, Independent Movies",91 min,1.6692472187608849
15931,Alex Smith,67,Australia,s4884,Si saben cómo me pongo ¿pá qué me invitan?,"Comedies, International Movies",89 min,0.4197964028442247
5751,John Brown,76,Mexico,s6245,Barely Lethal,"Action & Adventure, Comedies",99 min,4.501789734261055
10264,Chris Williams,45,Canada,s2104,Class of '83,"Dramas, International Movies, Thrillers",98 min,0.24626357738738558
10813,Alex Brown,36,Mexico,s1303,MeatEater,"Docuseries, Reality TV, Science & Nature TV",4 Seasons,3.400615571764487
22362,David Garcia,57,Japan,s6529,Conor McGregor: Notorious,"Documentaries, Sports Movies",90 min,3.3210564152404665
2272,Emma Davis,66,Canada,s5548,Killa,"Dramas, International Movies",107 min,0.5865063465468756
3264,Katie Martinez,80,Mexico,s7162,Kaaliyan,"Dramas, International Movies",105 min,0.3416272467478443
6551,James Davis,62,Brazil,s7012,"Houston, We Have a Problem!","Comedies, Independent Movies, International Movies",84 min,2.025746511855334
21053,Alex Williams,25,India,s2244,We Are One,"Documentaries, International Movies, Music & Musicals",86 min,0.28416735489696365
7808,Sarah Smith,78,Australia,s8241,The Cell,"Action & Adventure, Dramas, International Movies",126 min,4.594915116493665
16601,James Miller,60,UK,s955,The Yeti Adventures,"Children & Family Movies, Comedies",85 min,2.542434085570962
24768,Sarah Johnson,30,Brazil,s3381,The Awakening of Motti Wolkenbruch,"Comedies, Dramas, International Movies",94 min,0.5658621227135968
271,Sarah Johnson,60,India,s3085,Rainbow Ruby,Kids' TV,1 Season,3.8106589486378923
11105,James Garcia,44,France,s5273,VeggieTales in the City,Kids' TV,2 Seasons,4.204759399471719
8962,Emma Brown,17,France,s6613,Dinner for Schmucks,Comedies,115 min,0.3543597250542635
4884,Alex Jones,70,Germany,s4863,Saint Seiya: The Lost Canvas,"Anime Series, International TV Shows",1 Season,3.423820209966114
576,David Brown,44,UK,s5968,'89,Sports Movies,87 min,1.5992425017245786
19207,Katie Jones,22,India,s3355,Grego Rossello: Disculpe las molestias,Stand-Up Comedy,65 min,2.8078609984803142
3505,Katie Miller,28,Australia,s445,Naomi Osaka,Docuseries,1 Season,0.986591519606006
12617,Sarah Miller,40,Canada,s7027,Hunt to Kill,Action & Adventure,97 min,3.518062566285024
7563,David Miller,63,India,s5430,Kanavu Variyam,"Comedies, Dramas, International Movies",104 min,3.5605372423683814
6034,James Jones,26,Japan,s8167,Terminator 3: Rise of the Machines,"Action & Adventure, Sci-Fi & Fantasy",109 min,0.4472131912542543
12176,Michael Hernandez,62,Australia,s2464,Grandmother's Farm,"Comedies, Horror Movies, International Movies",71 min,3.8336854561726326
10504,Katie Smith,72,Brazil,s227,Post Mortem: No One Dies in Skarnes,"International TV Shows, TV Comedies, TV Dramas",1 Season,3.9939249171958116
7831,David Davis,16,Canada,s1922,The Outpost,"Action & Adventure, Dramas",123 min,0.09782200658299933
22810,Michael Miller,71,Mexico,s2322,George Lopez: We'll Do It For Half,Stand-Up Comedy,52 min,2.4900102648608007
24828,John Jones,80,UK,s3945,Tijuana,"Crime TV Shows, International TV Shows, Spanish-Language TV Shows",1 Season,2.0877419048029635
11930,Katie Johnson,76,India,s2485,Lock Your Girls In,"Comedies, International Movies, Romantic Movies",233 min,4.273243230083733
7229,Michael Johnson,46,India,s6637,Doubles Cause Troubles,"Action & Adventure, Comedies, International Movies",94 min,4.358129450619384
3500,Michael Smith,60,France,s3640,Girls With Balls,"Comedies, Horror Movies, International Movies",77 min,2.9033635073436104
16146,Chris Jones,42,Mexico,s6270,Because We're Heading Out,"Comedies, International Movies",99 min,2.828013444451132
2261,John Martinez,46,Germany,s786,Cocomelon,Kids' TV,3 Seasons,3.419928365614221
24294,Katie Williams,64,Australia,s5129,Dawai Asmara,"International TV Shows, TV Dramas",1 Season,2.7090838504228287
19024,Emma Brown,75,France,s4152,Virsa,"Dramas, International Movies, Music & Musicals",127 min,1.730255205062205
10484,Emma Martinez,19,Germany,s4770,GODZILLA City on the Edge of Battle,"Action & Adventure, Anime Features, International Movies",101 min,2.067009568626573
17165,Emma Martinez,74,Mexico,s4668,​​Kuch Bheege Alfaaz,"Dramas, Independent Movies, International Movies",110 min,4.319490210880615
16581,Emma Garcia,55,Japan,s8479,The Rebound,"Documentaries, Sports Movies",77 min,4.535482261474993
3383,John Garcia,26,India,s5004,Ravenous,"Horror Movies, International Movies",104 min,3.8283914209098144
2433,John Miller,54,Canada,s5881,"Trailer Park Boys: Drunk, High and Unemployed: Live in Austin","Comedies, International Movies",74 min,1.5612452977912543
21217,James Garcia,67,Germany,s3457,Super Monsters: Vida's First Halloween,Children & Family Movies,24 min,2.6616254853230634
7335,Sarah Jones,66,UK,s2421,Choked: Paisa Bolta Hai,"Dramas, International Movies",114 min,2.750934831715697
3519,Sarah Johnson,40,USA,s8166,Teresa,"International TV Shows, Romantic TV Shows, Spanish-Language TV Shows",1 Season,3.1744002527834745
19333,Emma Brown,33,France,s7881,Rocky II,"Dramas, Sports Movies",119 min,1.632716133110118
2587,Alex Jones,17,Japan,s4480,Great News,TV Comedies,2 Seasons,2.242003396294174
11082,Chris Hernandez,79,Japan,s4073,Evening Shadows,"Dramas, Independent Movies, International Movies",102 min,0.19333432817364826
6935,Chris Hernandez,33,USA,s1147,Haunted: Latin America,"International TV Shows, Reality TV, Spanish-Language TV Shows",1 Season,0.3163476619876032
15364,John Garcia,68,France,s1010,Rudra: Secret of the Black Moon,Children & Family Movies,87 min,0.9102547355787216
21080,Jane Garcia,29,India,s6259,Be-Be-Bears,Kids' TV,1 Season,0.5562513316353246
14849,Emma Smith,53,Canada,s7909,Russell Peters vs. the World,"Docuseries, Stand-Up Comedy & Talk Shows",1 Season,1.1450594754010273
10563,Sarah Miller,72,Brazil,s261,The Defeated,"Crime TV Shows, International TV Shows, TV Dramas",1 Season,4.62161135305664
10662,James Miller,52,Brazil,s2767,Maska,"Comedies, Dramas, International Movies",112 min,1.6101190582498237
21269,Michael Davis,71,UK,s2970,Together For Eternity,"Dramas, International Movies, Music & Musicals",176 min,0.05121984893051268
16236,James Hernandez,61,USA,s6392,Burlesque: Heart of the Glitter Tribe,Documentaries,76 min,1.9544349969791859
24383,James Miller,69,UK,s1049,Power Players,Kids' TV,3 Seasons,4.914848932929244
23066,Chris Johnson,72,Germany,s6688,Emelie,"Horror Movies, Thrillers",82 min,2.7980974209309077
2786,Michael Smith,29,Australia,s2848,Freaks,"Independent Movies, Sci-Fi & Fantasy, Thrillers",105 min,1.8775036612537754
7100,John Jones,56,Brazil,s7356,LoveTrue,Documentaries,82 min,0.6653475786231222
13832,James Davis,77,France,s657,Love Is a Story,"International Movies, Music & Musicals, Romantic Movies",105 min,3.519421654260524
2114,Emma Martinez,58,Australia,s3379,Nailed It! Spain,"International TV Shows, Reality TV, Spanish-Language TV Shows",1 Season,1.8540295378815759
22182,John Martinez,15,USA,s4472,Been So Long,"Dramas, International Movies, Music & Musicals",100 min,4.09794552599503
16695,Chris Jones,50,Canada,s3299,Wild District,"Crime TV Shows, International TV Shows, Spanish-Language TV Shows",2 Seasons,0.9799629120702869
8788,Alex Martinez,72,Japan,s7446,Merantau,"Action & Adventure, Dramas, International Movies",112 min,0.30562582546379446
21239,Katie Johnson,35,Japan,s3638,Boi,"Dramas, Independent Movies, International Movies",111 min,1.5806212347701132
14832,Katie Hernandez,42,Canada,s6999,Horror Homes,"British TV Shows, Docuseries, International TV Shows",1 Season,4.245873516009246
7972,Katie Miller,44,India,s6003,2307: Winter's Dream,"Action & Adventure, Independent Movies, Sci-Fi & Fantasy",101 min,2.161504067242972
17895,Chris Johnson,20,Australia,s3410,The Laundromat,"Comedies, Dramas",96 min,4.356089578498323
24548,Emma Jones,52,Brazil,s5217,Laws of Attraction,"International TV Shows, Romantic TV Shows, TV Comedies",1 Season,0.459000542043293
10113,Jane Williams,80,Canada,s8764,WWII: Report from the Aleutians,Documentaries,45 min,4.302823067407847
22837,Katie Johnson,48,India,s4962,Rapture,Docuseries,1 Season,4.352989539966554
23382,Jane Brown,13,USA,s8098,Storage Wars: Northern Treasures,"International TV Shows, Reality TV",1 Season,1.7618211181151207
22640,Emma Williams,62,Japan,s1543,Vir Das: Outside In - The Lockdown Special,Stand-Up Comedy,50 min,4.266030642654586
16096,John Jones,25,Mexico,s6757,Fire at Sea,"Documentaries, International Movies",114 min,2.3670847763469376
24729,Katie Johnson,55,Australia,s530,Return of the Prodigal Son,"Dramas, International Movies",124 min,3.454841068705708
5846,Emma Johnson,48,Germany,s4945,Fary Is the New Black,Stand-Up Comedy,75 min,0.33868122827840963
11804,Michael Davis,35,France,s7317,Little Nicky,Comedies,90 min,0.7154612633822338
22119,James Jones,15,Australia,s4324,Super Monsters and the Wish Star,Children & Family Movies,28 min,3.831193058720024
14049,Katie Smith,29,Canada,s2050,You're My Boss,"Comedies, International Movies, Romantic Movies",117 min,4.646912784714876
17650,David Miller,50,Germany,s3731,The Wolf's Call,"Dramas, International Movies, Thrillers",116 min,4.808339563341688
15980,James Brown,24,Brazil,s3620,I'm Brent Morin,Stand-Up Comedy,67 min,1.6293851329612663
9671,David Martinez,70,France,s3320,Hey Arnold! The Jungle Movie,"Children & Family Movies, Comedies",81 min,0.2275588563220593
9712,Jane Martinez,58,India,s4793,Chalte Chalte,"Dramas, International Movies, Romantic Movies",166 min,2.9707054750742508
4221,Chris Hernandez,46,USA,s7339,Los 10 años de Peter Capusotto,"International TV Shows, Spanish-Language TV Shows, TV Comedies",1 Season,2.0857066561481554
11313,Jane Miller,17,Canada,s6348,Bob Ross: Beauty Is Everywhere,TV Shows,1 Season,2.531126572895235
1920,Emma Smith,61,USA,s2283,One by Two,"Comedies, Dramas, International Movies",135 min,4.310026888870987
9591,Emma Williams,68,Japan,s1623,Stargate SG-1,"Classic & Cult TV, TV Action & Adventure, TV Sci-Fi & Fantasy",10 Seasons,4.486878499678269
21012,Katie Davis,18,Australia,s7770,Power Rangers Ninja Storm,Kids' TV,1 Season,4.836640184662074
16100,Jane Miller,16,Canada,s5451,How to Stage a Coup,Documentaries,47 min,1.3584459423312851
24569,David Williams,24,UK,s2645,"Yours Sincerely, Kanan Gill",Stand-Up Comedy,72 min,2.5601276935962387
24031,Michael Miller,14,Australia,s5280,Fabrizio Copano: Solo pienso en mi,Stand-Up Comedy,60 min,3.9068064043647874
2377,Alex Williams,47,Japan,s5669,Happy And,"International TV Shows, Korean TV Shows, TV Dramas",1 Season,0.4081330984722087
9037,Michael Jones,65,Mexico,s7833,Ranbhool,"Horror Movies, International Movies, Thrillers",115 min,3.7138066920293693
8109,John Miller,21,Canada,s7142,Jora 10 Numbaria,"Action & Adventure, International Movies",135 min,3.0183456152009662
14764,Michael Smith,26,France,s7353,Love You... Love You Not,"Comedies, International Movies, Romantic Movies",115 min,0.6229219650004375
23055,David Williams,77,Germany,s8719,Westside vs. the World,"Documentaries, Sports Movies",96 min,1.3818933647083154
15916,Jane Miller,71,France,s6635,Doom,"Action & Adventure, Horror Movies, Sci-Fi & Fantasy",105 min,0.29784098556493777
4255,Emma Martinez,58,Mexico,s7666,One Night Stand,"Dramas, International Movies, Music & Musicals",93 min,2.9364543099885876
7236,Jane Miller,63,Australia,s6183,"Aram, Aram","Dramas, Independent Movies",79 min,0.6042146501047146
5723,John Smith,72,Germany,s3635,The Red Sea Diving Resort,"Dramas, Thrillers",130 min,2.280295609127345
16581,Emma Garcia,55,Japan,s6144,American History X,Dramas,119 min,0.9677807266669358
15593,Jane Miller,29,Australia,s4612,Vettai,"Action & Adventure, International Movies, Music & Musicals",156 min,4.143159269391257
